strategy_id,strategy_name,budget_required,min_budget,max_budget,technical_expertise,time_investment,min_time_weekly,max_time_weekly,conversion_rate,brand_awareness,lead_generation,customer_retention,best_for_industry,target_audience_size
799,NextGen Social Media Marketing Plan,2,815,5432,3,2,4,30,3,1,3,5,"Products,Technology,Professional Services,Digital Products",2
800,NextGen Augmented Reality Marketing Plan,2,469,6116,5,3,3,19,4,3,5,5,"Real Estate,Gaming",2
801,Smart Trade Shows & Events Campaign,3,278,6895,3,3,9,29,4,3,3,1,"Finance,Lifestyle,Fitness",2
802,Advanced Content Marketing Growth,4,1435,3823,1,4,8,27,3,4,1,2,"Technology,Fitness",2
803,AI-Driven Pay-Per-Click Advertising Plan,3,1505,2694,5,2,6,17,4,2,1,2,Entertainment,2
804,Advanced Voice Search Optimization Campaign,3,1415,2187,4,2,2,28,2,2,5,2,Fitness,4
805,Smart Social Media Ads Engagement,3,1876,5130,1,2,2,27,3,2,2,2,Fitness,2
806,Targeted Interactive Content Plan,5,906,6460,5,3,8,11,5,2,4,2,"Professional Services,Restaurants,Beauty",5
807,NextGen Augmented Reality Marketing Plan,2,343,3922,2,4,6,28,3,4,5,2,Manufacturing,4
808,Hyper Pay-Per-Click Advertising Growth,3,486,3381,5,1,10,23,1,1,3,2,"Services,E-commerce",5
809,Targeted PR Campaigns Engagement,5,163,3476,5,3,1,30,1,3,2,4,"Services,News",3
810,Smart Native Advertising Plan,4,1694,2764,3,2,1,30,2,1,2,1,"Beauty,Fitness",5
811,Dynamic SMS Marketing Plan,5,1072,8212,1,2,2,23,5,5,5,3,"Retail,Technology",4
812,Hyper Webinars Strategy,1,1470,2457,1,2,1,11,2,4,1,1,"Restaurants,All,Retail,E-commerce",5
813,Advanced User-Generated Content Growth,3,655,5527,5,4,7,20,5,1,5,1,"B2B,Fashion",1
814,AI-Driven Local SEO Plan,5,162,8316,1,2,6,13,1,1,1,1,"Beauty,B2B,News,Local Business",1
815,Hyper PR Campaigns Outreach,2,1522,4025,5,3,9,26,2,5,4,1,Gaming,4
816,Dynamic User-Generated Content Campaign,2,577,9352,3,3,3,20,1,5,1,1,"All,Food,SaaS,Products",4
817,AI-Driven User-Generated Content Engagement,5,554,8443,4,4,9,17,2,1,1,5,"Restaurants,Digital Products,Education",1
818,Targeted Interactive Content Engagement,1,305,6588,1,3,7,24,5,4,4,4,"Education,Products",3
819,Dynamic Webinars Campaign,2,1707,4484,1,1,8,30,5,1,3,1,"Products,Local Business",3
820,Advanced SMS Marketing Engagement,3,1480,2598,2,3,7,19,3,2,4,4,"Professional Services,Manufacturing",1
821,NextGen LinkedIn Marketing Outreach,3,1906,9600,3,2,2,25,3,4,3,2,"Digital Products,Gaming",5
822,Hyper Interactive Content Campaign,1,1882,6413,3,4,1,29,4,5,2,1,"Fashion,Retail,Real Estate,Beauty",2
823,Smart Local SEO Growth,3,465,8626,5,4,8,12,1,2,3,1,"Local Business,SaaS,Gaming",3
824,Ultimate Conversational Marketing Campaign,3,533,5407,4,2,5,21,5,2,4,4,Products,5
825,AI-Driven Augmented Reality Marketing Growth,2,1352,8156,1,1,5,14,2,2,3,1,Professional Services,2
826,AI-Driven Search Engine Optimization (SEO) Growth,1,1262,7215,2,5,5,21,1,3,3,3,B2B,3
827,Hyper Community Marketing Engagement,5,667,8942,2,4,8,27,3,2,5,4,"Travel,News,Finance",3
828,Dynamic Local SEO Plan,2,1092,5297,1,5,3,20,3,1,1,4,"Beauty,Finance",3
829,Dynamic Native Advertising Outreach,3,738,5134,1,3,7,17,1,5,2,4,"Beauty,Entertainment,Finance,Real Estate",5
830,Ultimate User-Generated Content Engagement,5,764,2711,4,1,4,16,5,4,4,2,Entertainment,3
831,Ultimate Video Marketing Campaign,2,275,5550,5,2,3,22,5,2,4,3,"Beauty,Technology,Real Estate,All",5
832,Targeted Influencer Marketing Growth,1,1780,3668,1,5,5,16,4,1,5,4,Technology,2
833,Smart Micro-Influencer Marketing Campaign,1,897,8822,4,2,7,16,1,3,5,1,"Fitness,Professional Services",3
834,Advanced Social Media Ads Campaign,5,591,4741,5,3,2,25,3,3,1,5,"Retail,Events",1
835,Hyper Affiliate Marketing Strategy,4,110,5291,5,3,10,24,3,4,1,1,"Digital Products,Fitness,Food,News",3
836,Smart Social Media Ads Growth,5,565,3831,2,5,3,13,2,3,1,3,"Technology,Travel,Food,Fitness",4
837,AI-Driven Community Marketing Growth,5,1867,3381,4,4,2,22,4,5,2,3,Restaurants,5
838,NextGen Augmented Reality Marketing Campaign,5,995,7374,1,3,3,22,5,1,4,4,"Restaurants,B2B",5
839,Smart Community Marketing Strategy,5,1584,5220,1,5,2,18,4,3,4,3,"Digital Products,Products",3
840,AI-Driven Webinars Growth,3,1259,9438,4,2,8,10,2,3,1,1,"Fitness,Beauty",2
841,AI-Driven Social Media Marketing Plan,2,638,4238,4,1,9,25,3,2,4,2,"Services,Products,Events,Technology",4
842,Dynamic Search Engine Optimization (SEO) Plan,1,1547,2374,2,1,8,13,4,3,2,1,"Retail,B2B,SaaS,Food",4
843,Smart Voice Search Optimization Campaign,2,1509,8541,5,1,2,10,2,2,1,4,"Products,News,Travel",3
844,Advanced Podcast Advertising Strategy,2,1267,7709,5,2,3,13,3,4,4,5,"Restaurants,Manufacturing,Retail",5
845,Targeted Influencer Marketing Campaign,1,749,7923,2,3,10,15,3,3,5,3,"Food,Finance,Manufacturing",2
846,Hyper Video Marketing Outreach,1,1364,8265,3,4,7,25,1,5,1,1,"Products,News",4
847,AI-Driven Conversational Marketing Plan,1,1499,7676,2,5,3,23,1,2,3,3,"Services,Food,Manufacturing",2
848,Ultimate Conversational Marketing Outreach,2,1340,4337,4,2,10,15,1,1,5,4,Events,5
849,NextGen Augmented Reality Marketing Campaign,1,674,5479,3,5,3,11,4,1,1,3,Technology,1
850,NextGen Email Marketing Campaign,2,1217,4856,1,5,8,20,4,1,2,5,"Retail,Finance",3
851,AI-Driven Loyalty Programs Growth,2,1664,7703,5,2,5,23,3,3,3,5,All,2
852,Dynamic Loyalty Programs Strategy,5,1185,5199,5,4,4,13,1,1,3,1,"Entertainment,Beauty,Products",1
853,AI-Driven Podcast Advertising Growth,2,1243,7881,2,5,9,19,1,4,4,5,"B2B,Local Business,SaaS,Professional Services",5
854,Hyper Local SEO Plan,5,1047,2996,4,5,10,18,3,3,3,4,"B2B,Travel",1
855,NextGen Webinars Plan,4,1213,5775,5,5,5,27,3,2,4,3,"Beauty,Lifestyle,Entertainment,Services",5
856,Dynamic Micro-Influencer Marketing Outreach,2,1448,6236,3,1,9,22,2,1,5,1,"Fashion,Lifestyle",2
857,Ultimate User-Generated Content Growth,4,1966,4620,5,3,6,19,2,4,3,5,Products,1
858,Smart Podcast Advertising Strategy,5,757,2317,5,5,3,14,4,3,5,2,"Travel,Local Business,E-commerce,Fashion",2
859,Advanced Content Marketing Outreach,3,1207,3963,1,2,8,22,2,2,5,1,E-commerce,3
860,Ultimate Conversational Marketing Campaign,3,1956,8556,5,2,9,12,5,3,2,3,"Professional Services,Finance,SaaS",3
861,Hyper Customer Referral Programs Plan,2,587,8611,1,5,7,19,5,1,1,3,E-commerce,2
862,Ultimate Search Engine Optimization (SEO) Campaign,5,1153,7197,3,1,6,12,5,3,1,2,SaaS,1
863,Dynamic Augmented Reality Marketing Engagement,3,1600,8021,5,2,2,11,5,2,3,3,Fitness,5
864,Hyper PR Campaigns Plan,4,1766,5015,4,2,7,12,2,1,5,3,All,1
865,AI-Driven Customer Referral Programs Growth,1,1091,9316,3,5,7,24,1,1,2,1,"Beauty,Local Business,Manufacturing",3
866,Advanced SMS Marketing Engagement,2,870,6896,3,2,6,24,5,4,2,3,Events,4
867,Targeted Interactive Content Engagement,2,113,3713,2,2,9,13,2,4,4,3,"Finance,Travel",5
868,Dynamic Outbound Sales Plan,5,996,8003,2,1,7,11,4,3,2,1,"Gaming,News,Fitness,Restaurants",2
869,Dynamic Search Engine Optimization (SEO) Growth,2,1728,4630,1,5,6,14,1,2,1,4,"Technology,News,B2B,SaaS",4
870,Hyper User-Generated Content Growth,1,1087,6296,4,2,4,23,3,5,3,2,"Lifestyle,E-commerce,Food",1
871,Dynamic Mobile App Marketing Engagement,2,1580,5768,4,2,7,11,3,3,1,5,"SaaS,Services,Food",2
872,AI-Driven Podcast Advertising Growth,2,109,2418,3,3,5,21,5,2,2,1,"Food,Technology,Education",5
873,Hyper LinkedIn Marketing Outreach,4,1225,3909,4,4,3,19,5,4,4,2,"Gaming,Local Business,B2B",4
874,Targeted Social Media Marketing Growth,3,1949,5018,1,5,6,13,4,4,4,1,B2B,3
875,Dynamic Local SEO Growth,2,850,4980,3,2,4,19,3,2,2,2,"Fitness,Gaming,Digital Products,Products",2
876,AI-Driven PR Campaigns Outreach,2,1547,8707,2,3,9,24,2,1,4,5,"Events,Fitness,Products",3
877,AI-Driven Loyalty Programs Plan,3,471,7623,1,5,9,14,5,2,3,4,E-commerce,4
878,Advanced Search Engine Optimization (SEO) Strategy,4,486,5641,3,1,3,24,5,3,1,1,"Beauty,Events",5
879,Smart PR Campaigns Outreach,1,684,8771,5,5,7,15,3,5,5,5,"Restaurants,SaaS,Professional Services,Lifestyle",2
880,Advanced Customer Referral Programs Growth,2,301,5756,2,3,5,14,4,5,2,1,"Education,SaaS,Gaming,Restaurants",3
881,Smart Local SEO Engagement,3,506,3802,3,5,3,21,1,2,3,1,"Entertainment,Services,B2B,E-commerce",1
882,Smart Influencer Marketing Engagement,1,1629,5667,1,1,10,26,3,4,3,2,"Real Estate,Fashion,Retail,Finance",5
883,NextGen Local SEO Campaign,2,656,7509,3,4,5,10,3,4,3,1,"Manufacturing,B2B,Fitness,Professional Services",2
884,Smart Micro-Influencer Marketing Strategy,3,319,4492,5,5,8,15,3,3,1,2,"Local Business,Finance,News,Lifestyle",4
885,Hyper Social Media Marketing Engagement,2,320,2146,4,4,9,27,1,1,1,4,Food,3
886,Ultimate Social Media Marketing Growth,5,664,5659,2,2,5,11,1,1,1,1,"Events,B2B,E-commerce",1
887,Advanced Augmented Reality Marketing Strategy,3,1000,5662,3,4,7,30,1,4,5,2,"Restaurants,Travel,Real Estate",1
888,Dynamic Social Media Ads Plan,5,1805,8993,5,5,10,28,4,4,4,2,News,1
889,Smart Content Marketing Engagement,4,121,2213,2,2,5,19,5,1,3,1,"Lifestyle,Retail,Gaming",5
890,Targeted Native Advertising Growth,3,548,4490,1,3,7,23,2,1,1,1,"Technology,Products,Professional Services,Gaming",1
891,Smart Community Marketing Plan,5,1116,9661,1,2,5,30,4,4,3,3,"Fitness,Restaurants,Technology,All",4
892,Hyper Native Advertising Outreach,2,710,4425,4,2,8,22,4,5,5,5,"B2B,Real Estate,Products,Professional Services",1
893,Advanced LinkedIn Marketing Strategy,3,667,8628,1,1,4,17,2,4,3,5,"Technology,Services,Beauty",3
894,NextGen Affiliate Marketing Outreach,1,1578,8036,1,5,7,18,5,4,4,5,"Entertainment,Professional Services",5
895,AI-Driven Interactive Content Campaign,3,960,2498,4,2,5,18,5,4,2,2,"Services,Travel,Food,Products",2
896,Smart Influencer Marketing Plan,1,1158,5042,4,4,4,25,3,2,2,1,SaaS,5
897,Hyper Augmented Reality Marketing Engagement,5,1962,5602,4,4,3,10,2,3,1,1,"Fitness,SaaS",5
898,NextGen Affiliate Marketing Growth,3,1767,5748,3,3,8,27,1,1,2,1,"Products,All,Retail,Professional Services",5
899,Ultimate Voice Search Optimization Plan,3,270,6374,5,1,3,28,1,2,1,4,"Beauty,Local Business,Professional Services",3
900,Targeted Webinars Engagement,2,1702,7964,2,5,7,13,1,1,4,1,"Education,Lifestyle,Food",4
901,Targeted Native Advertising Campaign,3,1489,5037,2,1,4,25,1,3,2,3,Restaurants,1
902,Smart Interactive Content Outreach,3,1949,2237,5,5,5,12,1,3,1,1,"Entertainment,Professional Services",5
903,NextGen Loyalty Programs Engagement,4,554,4569,5,4,5,30,3,4,3,2,"Real Estate,Digital Products,Local Business,Beauty",2
904,Ultimate Trade Shows & Events Growth,4,1112,5334,4,1,8,10,4,4,4,2,"Lifestyle,News,Products,B2B",4
905,Ultimate Outbound Sales Outreach,2,1830,5804,3,2,9,23,4,2,5,4,Entertainment,4
906,Dynamic Retargeting Campaigns Outreach,4,1885,5040,5,4,7,17,4,2,4,5,"Gaming,Entertainment",2
907,Dynamic Interactive Content Strategy,3,351,4713,2,4,10,24,4,3,1,1,B2B,3
908,Advanced Augmented Reality Marketing Strategy,4,496,4199,4,4,3,16,5,1,5,5,"Finance,Products",3
909,Hyper Affiliate Marketing Engagement,4,1591,5235,4,1,7,20,1,5,3,5,"SaaS,News,Fashion,E-commerce",3
910,Smart PR Campaigns Engagement,2,1637,6990,2,3,5,23,2,5,5,4,"Entertainment,Professional Services,Lifestyle",4
911,NextGen Video Marketing Engagement,3,745,7039,4,3,7,20,3,4,5,3,"Real Estate,Events,Services,E-commerce",3
912,Advanced Community Marketing Growth,3,1245,7685,3,1,9,30,4,2,2,3,All,2
913,Advanced Outbound Sales Engagement,2,822,9068,3,4,9,29,5,2,5,4,"Entertainment,Finance,Digital Products,Events",2
914,Hyper Email Marketing Outreach,1,762,7225,5,5,1,27,4,5,2,2,"Real Estate,Technology,Travel",5
915,Targeted Trade Shows & Events Engagement,1,1026,8953,1,5,10,21,2,2,3,4,"All,Real Estate,Fitness,Professional Services",3
916,Targeted Social Media Marketing Plan,2,1010,9263,4,3,1,21,2,5,2,5,"Food,Restaurants,Gaming,All",1
917,Ultimate User-Generated Content Plan,1,773,5527,3,1,7,16,4,5,3,2,"Local Business,Retail,Products",1
918,Dynamic Voice Search Optimization Outreach,5,312,7395,5,5,10,11,4,4,4,2,"Products,Real Estate,Travel",5
919,Dynamic Local SEO Engagement,3,1078,3573,4,2,5,19,2,4,5,4,"Lifestyle,B2B,Real Estate,Food",2
920,Targeted Video Marketing Plan,3,1908,6738,1,4,7,26,2,5,5,1,"B2B,Fashion,Products",3
921,Hyper PR Campaigns Outreach,2,676,5992,1,5,4,27,4,1,1,5,Fitness,2
922,Ultimate Trade Shows & Events Strategy,1,1481,7120,5,3,3,18,2,4,5,5,"Local Business,Entertainment,Beauty",5
923,Ultimate Social Media Marketing Plan,2,1817,7268,4,1,10,24,2,3,5,5,"Digital Products,Food,Technology",5
924,Smart Community Marketing Engagement,3,1635,2674,4,4,10,25,3,1,3,2,"Beauty,Local Business",3
925,AI-Driven Community Marketing Engagement,2,1897,2718,3,1,7,21,4,4,1,5,"Finance,Professional Services,Fitness",3
926,Dynamic Search Engine Optimization (SEO) Plan,4,1539,5610,3,5,2,21,5,4,5,4,Finance,1
927,Hyper Mobile App Marketing Engagement,3,1119,8184,2,2,10,29,2,2,5,1,Fashion,4
928,Dynamic Webinars Growth,2,1579,4727,5,2,8,30,5,1,4,2,Fitness,4
929,Targeted Outbound Sales Engagement,5,1405,8644,2,4,9,18,4,1,1,2,"Finance,Technology,Beauty",1
930,Smart Retargeting Campaigns Growth,3,571,6549,4,5,2,26,5,2,1,1,SaaS,5
931,AI-Driven Voice Search Optimization Strategy,2,1177,9337,1,3,8,20,4,4,5,3,"Entertainment,Lifestyle,Digital Products,E-commerce",2
932,Dynamic Video Marketing Engagement,2,1141,8936,2,2,1,16,1,3,1,2,"Finance,Gaming,Digital Products",4
933,Targeted Mobile App Marketing Outreach,3,130,5592,4,4,1,21,1,2,5,2,"Lifestyle,Beauty,Professional Services,Events",3
934,NextGen Social Media Ads Growth,1,1264,2218,3,5,10,22,1,4,2,2,E-commerce,1
935,Smart Affiliate Marketing Campaign,3,606,9750,3,4,7,13,2,4,3,3,"Manufacturing,Restaurants",2
936,Smart Trade Shows & Events Campaign,4,863,6191,3,1,6,16,3,1,1,3,"Real Estate,Gaming",2
937,Advanced Outbound Sales Strategy,3,1936,4956,5,2,5,16,4,3,5,2,"Gaming,Digital Products,Services",4
938,AI-Driven Search Engine Optimization (SEO) Strategy,1,1542,6048,3,1,8,15,5,1,1,5,Beauty,3
939,Targeted Community Marketing Growth,2,940,2817,1,1,6,29,4,1,5,3,"Food,B2B",1
940,NextGen Outbound Sales Plan,5,917,6990,5,4,2,18,1,1,3,4,"Entertainment,SaaS",4
941,Advanced PR Campaigns Outreach,5,588,6010,5,5,7,25,2,4,5,1,Finance,2
942,AI-Driven Content Marketing Outreach,3,1208,4799,5,4,10,23,5,4,2,1,"Gaming,Entertainment,SaaS",3
943,Ultimate Conversational Marketing Outreach,3,646,9635,3,3,10,20,4,4,4,3,"Local Business,Education,Products",3
944,Targeted Video Marketing Strategy,2,460,5811,3,2,9,28,3,4,3,2,"Professional Services,Real Estate,Food,Travel",1
945,AI-Driven Trade Shows & Events Engagement,5,1815,3709,5,2,8,21,5,4,3,2,"Retail,Beauty,Finance",1
946,AI-Driven User-Generated Content Engagement,3,1724,9341,5,5,8,13,2,3,1,4,Food,3
947,Smart Social Media Ads Plan,2,1522,5255,3,2,10,10,2,3,3,1,Lifestyle,3
948,AI-Driven Podcast Advertising Growth,4,1350,2520,5,4,3,16,5,1,5,2,"Local Business,Services,Fitness,News",3
949,Targeted LinkedIn Marketing Outreach,1,1176,4803,4,4,6,16,4,4,1,5,"Technology,Products,B2B",2
950,Targeted PR Campaigns Campaign,2,1183,8992,2,3,8,19,3,5,4,4,Fitness,1
951,Targeted Content Marketing Plan,4,791,3193,2,4,10,10,4,4,1,4,"Real Estate,Beauty,Fashion",1
952,NextGen Podcast Advertising Plan,3,1009,4216,1,3,2,26,4,4,5,3,"Lifestyle,All,Professional Services",4
953,Targeted Native Advertising Engagement,3,137,4020,3,1,8,10,1,1,2,3,Professional Services,3
954,Hyper Influencer Marketing Engagement,5,261,8171,1,5,10,14,3,3,4,1,"Gaming,SaaS,Fitness",5
955,AI-Driven Guerrilla Marketing Strategy,3,997,3226,3,3,9,15,4,3,1,3,"Real Estate,Restaurants,Events",5
956,Targeted Outbound Sales Growth,3,1820,8215,1,1,10,17,1,1,5,2,"Digital Products,Local Business,Professional Services,E-commerce",1
957,Hyper Influencer Marketing Plan,5,379,5564,3,1,6,15,4,2,5,1,"Fitness,Products,Lifestyle",1
958,Ultimate PR Campaigns Outreach,4,1896,4371,2,3,7,15,3,1,4,4,Services,5
959,Dynamic Voice Search Optimization Campaign,5,1645,4691,5,1,2,20,3,1,3,3,"Restaurants,Events",1
960,NextGen Outbound Sales Engagement,3,1556,8183,3,2,7,20,5,4,3,5,"Finance,SaaS,Entertainment",4
961,Advanced Micro-Influencer Marketing Engagement,1,1112,8608,4,4,7,26,5,4,2,3,Lifestyle,1
962,Advanced Podcast Advertising Outreach,1,1262,4537,1,3,5,17,4,2,2,2,Real Estate,1
963,Ultimate Loyalty Programs Growth,5,976,2712,2,4,6,29,3,3,5,5,"Lifestyle,Fitness",2
964,Targeted Email Marketing Plan,1,497,5151,3,1,6,26,2,5,4,4,"Fitness,Fashion,E-commerce,SaaS",2
965,Hyper Community Marketing Plan,4,920,4405,4,5,2,26,4,1,3,2,"Beauty,Manufacturing",4
966,Ultimate Influencer Marketing Growth,1,477,2173,1,3,4,24,1,4,4,5,Manufacturing,4
967,Advanced Search Engine Optimization (SEO) Campaign,2,1728,5006,3,3,9,13,4,5,5,4,"Retail,Education,Travel,E-commerce",1
968,NextGen Affiliate Marketing Engagement,4,1236,6727,5,1,9,22,5,1,5,4,"Gaming,SaaS",4
969,Targeted Micro-Influencer Marketing Strategy,1,1208,3306,1,2,6,30,4,5,2,5,"Manufacturing,Food,All,Fitness",5
970,Targeted Podcast Advertising Campaign,4,1614,2529,2,2,5,24,1,5,4,2,"Gaming,Technology,Real Estate",3
971,Ultimate Interactive Content Engagement,1,1803,5966,4,1,10,23,2,3,5,3,"Finance,Events",4
972,Smart Customer Referral Programs Strategy,2,1903,6596,1,1,7,21,5,5,3,3,"E-commerce,Manufacturing,Lifestyle",2
973,Dynamic Voice Search Optimization Growth,5,1384,4963,2,2,6,17,1,2,4,4,"SaaS,Manufacturing",3
974,Hyper Conversational Marketing Growth,3,1126,9404,3,1,5,25,2,3,1,2,"B2B,Technology",3
975,NextGen Mobile App Marketing Plan,4,894,9139,4,1,1,16,3,3,3,4,"Restaurants,Lifestyle",1
976,Advanced SMS Marketing Campaign,1,1401,3599,4,5,3,20,2,3,2,3,"All,Services,News,Beauty",3
977,Advanced Retargeting Campaigns Growth,2,1612,5487,1,3,7,24,5,5,3,4,"Entertainment,Manufacturing,Real Estate",3
978,Advanced Interactive Content Growth,2,858,4422,2,2,1,26,4,3,4,2,Entertainment,2
979,Advanced Affiliate Marketing Campaign,5,1793,2719,3,1,10,30,2,3,1,1,"Finance,Gaming,Entertainment",4
980,Smart Affiliate Marketing Campaign,1,1832,2691,2,5,8,21,3,3,3,5,"News,Events,Restaurants",1
981,AI-Driven Trade Shows & Events Outreach,1,408,7190,4,2,6,15,1,3,3,1,"Fitness,Travel",5
982,Dynamic Augmented Reality Marketing Campaign,4,1700,6716,1,1,8,28,4,5,5,3,News,2
983,Hyper Pay-Per-Click Advertising Outreach,4,1740,5819,3,4,2,28,3,4,4,5,"Services,Technology,B2B,News",2
984,Targeted User-Generated Content Growth,4,125,8095,4,2,9,20,2,5,5,3,Services,3
985,Advanced Augmented Reality Marketing Plan,3,266,2461,1,2,4,16,4,5,5,4,"Fitness,Finance",2
986,Advanced Augmented Reality Marketing Growth,4,1821,6447,4,3,8,26,5,2,2,2,Travel,2
987,Targeted SMS Marketing Outreach,3,1740,8021,1,3,3,25,4,5,4,1,"Local Business,B2B,E-commerce,All",1
988,Targeted Influencer Marketing Strategy,3,652,5658,2,4,2,22,1,1,4,3,"News,SaaS,Education,Technology",1
989,Targeted Email Marketing Plan,2,1201,9018,3,4,6,23,3,5,4,3,"Local Business,Food",1
990,NextGen Customer Referral Programs Campaign,4,1814,7216,5,2,5,20,4,5,5,2,"Travel,Lifestyle,Finance,Food",1
991,NextGen Augmented Reality Marketing Engagement,4,121,3055,5,1,3,11,5,1,3,4,"Digital Products,Fashion",2
992,Ultimate Content Marketing Plan,2,189,6264,2,1,7,10,3,5,1,4,"Retail,Beauty,Local Business,SaaS",4
993,Targeted Pay-Per-Click Advertising Outreach,5,1715,8684,2,3,5,27,4,2,3,2,"Food,Products",1
994,Hyper Social Media Marketing Engagement,5,631,5490,1,1,8,26,1,5,2,3,"Services,Gaming,Travel",5
995,Advanced Search Engine Optimization (SEO) Campaign,2,638,5606,3,3,3,22,2,1,2,3,"Services,Restaurants,Food,Professional Services",3
996,NextGen Search Engine Optimization (SEO) Strategy,5,868,7543,5,4,5,29,3,3,1,2,"Products,Real Estate,Services",5
997,NextGen Outbound Sales Campaign,3,1158,8543,2,1,3,19,4,4,5,1,Technology,3
998,Hyper SMS Marketing Growth,3,1703,2280,1,5,2,29,2,2,2,2,"Food,Real Estate",4
999,AI-Driven Email Marketing Outreach,4,452,8500,3,4,8,26,3,2,5,1,Finance,3
1000,Dynamic Affiliate Marketing Growth,3,1413,2495,4,3,7,12,3,5,2,4,Products,4
