strategy_id,strategy_name,budget_required,min_budget,max_budget,technical_expertise,time_investment,min_time_weekly,max_time_weekly,conversion_rate,brand_awareness,lead_generation,customer_retention,best_for_industry,target_audience_size
533,Ultimate Trade Shows & Events Strategy,2,822,4840,2,1,10,18,5,2,3,2,"Events,Professional Services,Real Estate,Local Business",5
534,AI-Driven Retargeting Campaigns Plan,2,615,6105,1,3,7,26,1,3,1,5,"Products,Real Estate",1
535,Hyper PR Campaigns Growth,4,483,8646,1,4,4,11,4,5,4,3,"Food,Finance,Retail,Lifestyle",3
536,AI-Driven Outbound Sales Outreach,5,1658,5525,5,2,7,19,4,3,2,5,"Lifestyle,E-commerce,Entertainment",5
537,AI-Driven LinkedIn Marketing Growth,3,692,8282,2,1,10,12,2,4,5,4,"Finance,Education,Fitness,Food",5
538,Advanced Augmented Reality Marketing Growth,2,141,2016,4,4,1,26,1,4,1,3,"Entertainment,Technology",4
539,AI-Driven Webinars Strategy,2,888,9413,5,3,7,11,4,2,4,4,News,1
540,Advanced Interactive Content Engagement,3,517,9719,5,3,9,19,2,4,2,1,"Products,Technology,Events,SaaS",5
541,NextGen Mobile App Marketing Growth,2,477,5282,2,4,10,22,3,4,5,4,Real Estate,4
542,Advanced Trade Shows & Events Plan,3,1319,3890,1,2,2,14,4,4,4,2,"Events,Entertainment,Education",1
543,Advanced Podcast Advertising Growth,4,280,2958,1,3,10,29,3,2,3,2,Gaming,1
544,Smart PR Campaigns Strategy,5,994,2628,1,2,2,27,4,2,5,2,"Fitness,SaaS,Fashion",1
545,Advanced LinkedIn Marketing Campaign,5,1930,4393,2,3,9,13,4,1,3,1,"Manufacturing,Products,Lifestyle",5
546,Dynamic Affiliate Marketing Growth,5,846,8808,1,5,10,30,2,2,4,4,"Technology,E-commerce,Digital Products",2
547,Hyper Augmented Reality Marketing Growth,2,471,9816,5,4,2,30,2,2,5,4,"Local Business,Manufacturing,SaaS,Retail",4
548,NextGen User-Generated Content Outreach,5,720,9848,5,1,5,13,2,5,2,2,"Fitness,Events,SaaS,All",5
549,Dynamic Augmented Reality Marketing Plan,2,1622,3173,4,3,4,15,5,4,1,1,"All,Lifestyle,Travel,Professional Services",4
550,Advanced Pay-Per-Click Advertising Engagement,3,1738,6167,2,4,10,13,5,5,5,5,"Services,Finance,Events,Professional Services",5
551,Targeted Customer Referral Programs Outreach,2,1575,6358,2,4,6,20,1,1,1,1,Real Estate,3
552,Advanced Trade Shows & Events Campaign,1,1819,7367,4,5,10,26,2,5,3,2,"Technology,Digital Products",2
553,Hyper Local SEO Campaign,5,905,6005,5,4,4,25,3,2,1,2,"All,Local Business,Restaurants,Professional Services",4
554,AI-Driven Augmented Reality Marketing Outreach,2,1440,6192,5,5,7,28,4,4,1,2,"Fashion,Technology,Local Business",4
555,Advanced Trade Shows & Events Campaign,5,797,8146,4,3,3,25,2,3,2,4,"Fitness,Retail",2
556,NextGen Augmented Reality Marketing Campaign,1,409,2355,1,3,7,12,1,2,1,1,"Travel,Local Business,Professional Services,Entertainment",1
557,Targeted Augmented Reality Marketing Growth,1,1033,4291,1,3,3,15,5,3,3,4,"Lifestyle,E-commerce,Education,Finance",4
558,Advanced Interactive Content Strategy,1,196,9306,5,3,10,28,3,3,3,1,"All,Lifestyle,Entertainment",4
559,Dynamic Trade Shows & Events Growth,4,1553,6987,5,2,3,26,3,2,3,1,"Restaurants,Education,Manufacturing",5
560,Hyper Email Marketing Outreach,1,1386,8885,1,1,2,16,5,2,3,5,Lifestyle,4
561,Smart Email Marketing Outreach,3,620,2086,4,2,10,18,4,2,5,5,"Events,Local Business",3
562,Smart Email Marketing Engagement,5,861,3847,1,5,2,30,5,1,3,2,"Food,Lifestyle",1
563,Ultimate Webinars Engagement,3,321,2211,1,4,5,17,2,2,4,2,Retail,2
564,Ultimate Trade Shows & Events Campaign,5,1427,6079,2,5,10,30,2,3,3,4,"Real Estate,Fitness",4
565,Ultimate Local SEO Campaign,3,589,8301,3,4,2,11,3,1,5,1,"SaaS,Finance,Education",4
566,AI-Driven Email Marketing Outreach,4,528,9642,5,2,4,23,4,3,1,2,Digital Products,1
567,AI-Driven Native Advertising Campaign,2,861,5295,2,1,2,15,5,1,3,3,Gaming,5
568,Smart Affiliate Marketing Strategy,3,779,6825,2,5,7,22,2,3,4,2,"SaaS,Real Estate,Food",1
569,NextGen Native Advertising Campaign,3,447,7689,1,4,1,25,5,5,2,1,"Travel,Professional Services,E-commerce",1
570,NextGen Local SEO Plan,3,209,8317,5,2,8,17,4,1,2,4,"Education,Food",1
571,Ultimate Content Marketing Campaign,5,1801,5652,3,3,10,10,5,4,2,4,Travel,4
572,Smart Local SEO Growth,1,325,9816,1,5,8,18,5,2,5,5,"Digital Products,Restaurants",4
573,NextGen User-Generated Content Engagement,2,1324,7126,5,4,1,20,1,1,2,5,Travel,3
574,Dynamic Conversational Marketing Growth,2,359,8592,3,1,7,24,2,1,3,1,"Fashion,B2B,News,Professional Services",5
575,Dynamic Podcast Advertising Plan,1,1484,4689,1,4,4,24,3,4,4,2,"Lifestyle,Beauty,B2B",2
576,Ultimate Podcast Advertising Plan,3,579,5568,4,4,10,27,4,4,1,1,"Travel,Local Business",1
577,Smart Search Engine Optimization (SEO) Campaign,2,1444,7987,1,2,9,30,5,3,2,2,"Real Estate,Education,Professional Services,Restaurants",4
578,Dynamic Webinars Strategy,5,187,7701,3,4,7,20,3,3,3,5,"Lifestyle,Technology",2
579,Targeted Conversational Marketing Engagement,2,933,2465,3,5,9,22,4,5,2,2,Professional Services,1
580,Dynamic PR Campaigns Plan,2,287,6780,2,2,7,17,3,1,1,5,"Gaming,Entertainment,Retail",4
581,AI-Driven Guerrilla Marketing Engagement,2,958,9843,4,3,8,16,3,4,2,1,"Manufacturing,Finance",5
582,Targeted LinkedIn Marketing Growth,5,1617,5220,5,1,9,23,1,4,4,5,Retail,3
583,Hyper Social Media Ads Campaign,1,525,9435,4,2,2,19,3,1,2,3,"Gaming,Events,Restaurants",1
584,Dynamic Micro-Influencer Marketing Plan,2,573,8796,2,3,3,11,5,4,2,1,Real Estate,1
585,Advanced Content Marketing Campaign,2,1687,3345,1,1,9,26,3,1,3,5,"Retail,Real Estate,Restaurants",5
586,Hyper Webinars Outreach,1,1841,5455,5,3,6,27,1,3,3,3,"Finance,Digital Products,Food,Retail",4
587,Advanced Conversational Marketing Growth,1,174,3990,4,3,3,15,1,3,5,1,"Digital Products,News,E-commerce",4
588,Smart Community Marketing Engagement,3,855,2434,2,3,2,16,5,2,5,4,Digital Products,2
589,Hyper Loyalty Programs Engagement,5,862,9244,3,4,2,20,2,4,3,5,"Technology,Manufacturing",3
590,Hyper Search Engine Optimization (SEO) Growth,3,640,6275,4,1,4,16,1,4,1,2,Education,1
591,Targeted Local SEO Campaign,5,383,4416,5,2,1,14,4,2,5,2,"Events,Fashion,E-commerce,Real Estate",2
592,Smart Augmented Reality Marketing Plan,4,760,4850,5,1,7,27,4,5,5,4,"B2B,Retail,All,Manufacturing",1
593,Advanced LinkedIn Marketing Outreach,2,706,3451,4,1,8,14,5,3,2,3,"Digital Products,Travel",3
594,Ultimate Social Media Marketing Strategy,5,1286,3181,4,3,4,16,3,1,1,4,Fitness,2
595,Dynamic Native Advertising Engagement,4,1269,8069,1,5,5,24,4,4,2,2,"Local Business,Real Estate",3
596,Advanced Voice Search Optimization Plan,3,814,7473,2,5,2,28,4,5,5,2,"All,Travel,Professional Services,Services",2
597,Ultimate PR Campaigns Growth,3,1253,3320,2,5,4,13,5,5,3,3,"Retail,Education",2
598,Hyper Outbound Sales Engagement,3,1537,3024,2,5,7,15,1,3,1,1,"Technology,Finance",2
599,NextGen Podcast Advertising Campaign,4,1336,6603,4,4,2,27,4,4,2,1,Restaurants,2
600,Dynamic PR Campaigns Plan,3,1803,5965,5,3,2,26,4,3,3,3,"Lifestyle,B2B",1
601,Advanced Outbound Sales Growth,5,1833,9217,4,4,6,28,5,4,4,1,"Products,Education,Digital Products,E-commerce",2
602,Targeted Content Marketing Strategy,1,1499,2923,2,4,2,20,2,5,4,2,"Travel,Real Estate,SaaS,Professional Services",1
603,Hyper Retargeting Campaigns Campaign,5,165,8770,1,1,8,25,5,2,5,1,Finance,3
604,Hyper Interactive Content Engagement,1,786,9525,4,2,5,15,1,5,1,5,Digital Products,5
605,Targeted SMS Marketing Growth,3,1251,7088,1,1,3,27,2,4,4,1,Entertainment,3
606,Advanced Podcast Advertising Growth,4,1386,7384,1,5,9,13,2,1,4,5,"Fitness,Food,Local Business",3
607,Dynamic Micro-Influencer Marketing Campaign,5,1692,9024,2,4,6,12,2,1,1,4,"Restaurants,B2B,Digital Products",3
608,Targeted Outbound Sales Outreach,3,243,4249,4,1,7,25,4,3,3,4,"Services,Education,Digital Products",1
609,Ultimate Video Marketing Campaign,1,1296,8018,3,3,9,19,4,2,4,1,"Restaurants,SaaS",3
610,Targeted Social Media Marketing Strategy,2,1310,7471,3,2,6,19,1,2,4,4,"Gaming,Travel,Food",5
611,Smart Loyalty Programs Outreach,3,381,7082,1,1,7,13,4,3,2,3,"E-commerce,Retail",1
612,Targeted Community Marketing Strategy,3,1777,8700,2,3,10,24,4,3,1,3,Fitness,5
613,AI-Driven Influencer Marketing Growth,2,283,3113,3,2,9,29,1,3,1,3,"Beauty,Travel,SaaS",4
614,Targeted SMS Marketing Growth,2,1823,6247,4,2,3,14,1,5,1,2,"Real Estate,Beauty,Retail,Professional Services",3
615,NextGen Video Marketing Outreach,3,1759,4871,5,5,3,10,5,2,3,3,"B2B,Retail,Products,Professional Services",2
616,Advanced SMS Marketing Growth,3,1255,4100,1,4,7,27,2,2,4,2,"E-commerce,Education",3
617,Advanced Podcast Advertising Plan,1,290,3025,4,3,2,17,4,5,3,4,"Entertainment,Services,Local Business,Digital Products",5
618,Smart Influencer Marketing Plan,2,1401,9261,4,2,10,22,1,4,4,3,"Fitness,Real Estate",4
619,Hyper Guerrilla Marketing Engagement,1,586,2719,1,2,5,30,1,3,3,3,"Entertainment,B2B,Beauty",1
620,Hyper Webinars Outreach,5,582,3762,2,1,8,22,4,5,1,1,"E-commerce,Fitness,SaaS,Manufacturing",1
621,Advanced Affiliate Marketing Engagement,2,1576,8506,4,1,2,21,4,4,1,4,"Retail,News",5
622,Advanced Loyalty Programs Growth,3,1823,4895,4,3,3,26,3,3,1,4,Technology,5
623,Smart Voice Search Optimization Outreach,4,927,3555,4,2,6,17,1,5,3,2,Retail,5
624,Ultimate Webinars Campaign,2,380,7177,2,5,8,15,2,1,1,4,"News,All,Restaurants,SaaS",1
625,NextGen Mobile App Marketing Plan,3,374,3085,5,2,7,21,5,5,3,2,Entertainment,5
626,AI-Driven Outbound Sales Engagement,2,1126,5658,3,5,2,18,3,3,4,2,"Fashion,Beauty,Lifestyle,E-commerce",2
627,Dynamic Trade Shows & Events Plan,2,946,8233,4,3,4,23,4,3,3,5,"Local Business,Retail,Travel",3
628,Advanced Search Engine Optimization (SEO) Outreach,5,539,8079,3,5,10,26,4,5,3,5,"Finance,Manufacturing",4
629,Targeted Augmented Reality Marketing Outreach,3,1357,3041,3,2,9,25,2,1,5,4,"Restaurants,Real Estate,All",1
630,Advanced Email Marketing Growth,3,653,3560,4,2,8,15,2,2,1,5,Services,3
631,Advanced Pay-Per-Click Advertising Strategy,4,519,4797,1,2,1,23,2,3,4,5,"Gaming,Beauty",5
632,Targeted Retargeting Campaigns Outreach,1,593,9935,5,3,2,21,3,1,4,5,"Services,Entertainment,Retail",1
633,NextGen Guerrilla Marketing Engagement,4,1076,4209,2,3,7,22,4,1,4,5,"Real Estate,Lifestyle,Services",4
634,Advanced Social Media Ads Strategy,3,342,8091,5,4,3,24,3,1,3,4,"All,Events,Manufacturing",1
635,Advanced Micro-Influencer Marketing Campaign,3,1790,6455,2,4,10,17,4,1,3,4,"Digital Products,Restaurants",3
636,Smart Community Marketing Outreach,3,1134,4586,1,5,9,13,2,2,3,2,"Fashion,Real Estate,Manufacturing",5
637,NextGen Guerrilla Marketing Growth,1,766,3944,5,2,9,13,5,5,3,3,"Education,News,Beauty",4
638,Dynamic Email Marketing Campaign,4,282,6004,4,5,1,26,3,5,5,1,"Products,SaaS",5
639,Hyper Outbound Sales Growth,3,1614,7858,2,1,9,19,4,1,2,2,"Restaurants,SaaS,Beauty,Lifestyle",3
640,Advanced Guerrilla Marketing Plan,1,1385,6699,3,1,2,20,4,3,5,4,"SaaS,Manufacturing",3
641,Hyper PR Campaigns Growth,4,1787,6291,4,4,5,23,2,2,5,1,"Entertainment,Manufacturing,Education",5
642,Hyper Guerrilla Marketing Strategy,2,371,4087,5,5,7,12,2,3,4,3,"Food,Real Estate,Education,B2B",1
643,Dynamic Trade Shows & Events Strategy,3,104,3556,2,3,4,18,1,4,4,4,"Professional Services,Fashion,News,E-commerce",5
644,NextGen Loyalty Programs Strategy,4,951,3106,4,2,2,15,1,4,5,2,"Restaurants,Services",1
645,Advanced Loyalty Programs Plan,4,789,8367,2,4,5,20,2,2,3,5,"Travel,Entertainment,Services,Products",2
646,Dynamic Influencer Marketing Engagement,1,524,8383,3,5,7,21,4,1,1,2,"Real Estate,Manufacturing",2
647,Targeted Augmented Reality Marketing Outreach,1,1128,9639,4,2,10,22,3,5,1,2,"Real Estate,Travel,Education,Restaurants",1
648,Smart Micro-Influencer Marketing Growth,4,537,3839,2,2,1,11,3,5,5,2,"Restaurants,Gaming,Fashion,All",2
649,Dynamic Social Media Marketing Campaign,2,406,7041,3,4,5,13,3,5,5,4,"All,Technology,Events,Professional Services",2
650,AI-Driven Email Marketing Growth,5,241,5100,5,4,1,12,2,4,5,4,"SaaS,Manufacturing,Events,Beauty",5
651,Targeted Guerrilla Marketing Strategy,4,1826,9137,1,2,7,24,3,1,4,1,"B2B,Products,Local Business,News",3
652,Ultimate Content Marketing Strategy,4,466,5799,5,2,2,12,4,3,1,1,"Education,B2B",4
653,Hyper LinkedIn Marketing Campaign,1,831,7571,1,4,4,28,1,3,4,3,"SaaS,Digital Products,Food,Restaurants",4
654,AI-Driven LinkedIn Marketing Plan,4,492,3230,5,2,1,25,4,5,2,3,"B2B,Education",5
655,NextGen Trade Shows & Events Outreach,5,185,3432,4,3,10,10,2,3,4,5,"Fitness,Events,E-commerce,Professional Services",5
656,Ultimate LinkedIn Marketing Plan,2,1346,3997,4,2,2,24,3,2,4,1,"Retail,Travel",5
657,AI-Driven Video Marketing Strategy,4,1517,4187,5,3,7,14,5,5,2,2,"Digital Products,Local Business,Products",2
658,Dynamic Customer Referral Programs Campaign,2,1329,7416,3,1,5,20,1,5,1,4,"Food,Travel",3
659,Targeted Voice Search Optimization Strategy,5,913,5951,4,2,5,16,4,5,5,2,"Beauty,Restaurants,E-commerce",4
660,Dynamic Native Advertising Growth,4,1744,3956,2,5,10,27,4,2,1,2,E-commerce,3
661,Targeted Micro-Influencer Marketing Engagement,5,1044,9930,4,4,2,28,3,3,5,3,"Services,Technology,Products",1
662,Dynamic Local SEO Plan,1,1560,2636,5,3,10,15,5,1,1,2,"Digital Products,Real Estate",2
663,Ultimate LinkedIn Marketing Plan,2,271,4843,1,5,2,26,1,4,3,4,"Events,Food,E-commerce",2
664,Dynamic Outbound Sales Growth,2,517,6221,2,1,7,14,5,2,5,2,"Professional Services,Gaming",2
665,Hyper Native Advertising Growth,3,103,2800,1,4,1,16,4,3,1,3,"Food,SaaS,Technology,Digital Products",1
666,Targeted Customer Referral Programs Strategy,4,499,2769,2,1,1,11,5,5,1,2,Products,2
667,AI-Driven SMS Marketing Plan,1,473,5814,2,3,3,25,5,2,4,3,"Local Business,Education",5
668,NextGen User-Generated Content Outreach,2,1566,2834,3,4,4,16,2,3,3,1,"Fashion,Technology,Professional Services",2
669,Dynamic Community Marketing Strategy,4,267,4548,5,2,1,18,2,4,2,2,Technology,4
670,Targeted Loyalty Programs Outreach,2,666,5950,3,4,4,26,1,4,2,1,B2B,3
671,Smart Outbound Sales Growth,1,139,8238,2,4,3,18,2,1,1,2,Fitness,1
672,Ultimate Outbound Sales Campaign,1,646,2106,5,4,7,20,3,4,3,3,Real Estate,1
673,Hyper Affiliate Marketing Growth,5,912,4605,5,5,8,24,2,3,2,3,Real Estate,4
674,Smart Influencer Marketing Engagement,5,531,5642,5,1,5,27,4,5,2,4,"Fashion,Restaurants,Technology",1
675,Advanced Trade Shows & Events Campaign,5,1380,9602,3,4,1,22,2,5,5,3,Services,2
676,NextGen Pay-Per-Click Advertising Campaign,4,1216,3578,2,3,1,26,2,4,4,3,Real Estate,3
677,Targeted Mobile App Marketing Outreach,4,1980,8241,4,1,1,24,3,1,1,3,E-commerce,5
678,Ultimate Voice Search Optimization Campaign,1,1113,8467,4,3,7,13,5,4,5,3,"Lifestyle,Real Estate,Local Business",2
679,Dynamic Trade Shows & Events Growth,2,636,7610,2,3,8,18,4,1,1,1,Manufacturing,3
680,Ultimate Trade Shows & Events Campaign,2,1030,4917,2,2,10,26,5,4,3,3,"Fashion,Food,Retail,SaaS",4
681,Advanced Retargeting Campaigns Growth,2,868,3643,3,2,1,17,5,1,2,2,Digital Products,3
682,Ultimate Mobile App Marketing Engagement,1,1417,7653,5,1,5,21,1,1,3,3,"SaaS,Finance",2
683,Smart Guerrilla Marketing Campaign,1,277,4510,3,3,4,24,3,2,4,1,"Products,Gaming",3
684,Targeted Loyalty Programs Strategy,4,1327,7380,1,2,1,24,3,4,2,3,"SaaS,Gaming,Digital Products,News",3
685,Hyper Voice Search Optimization Growth,3,1996,3356,4,5,1,16,3,1,5,1,"Fitness,Restaurants,Gaming,Finance",2
686,Dynamic Guerrilla Marketing Outreach,3,727,4085,5,1,9,18,4,4,4,3,Beauty,2
687,Advanced LinkedIn Marketing Plan,3,1670,3061,3,4,2,14,5,4,3,1,"Restaurants,Finance,News,Services",5
688,AI-Driven Voice Search Optimization Growth,1,174,6027,1,4,1,17,2,5,1,5,"Professional Services,SaaS,News,Local Business",2
689,Smart PR Campaigns Engagement,3,1050,2999,2,3,2,25,1,2,5,4,"All,Manufacturing",5
690,Hyper User-Generated Content Engagement,4,612,4574,4,5,2,22,4,3,3,3,"E-commerce,Lifestyle",5
691,NextGen Customer Referral Programs Growth,2,1239,8314,2,1,9,10,1,5,1,5,"Services,Events,Food,B2B",2
692,Dynamic PR Campaigns Plan,4,588,6103,5,2,6,21,2,1,3,4,"Entertainment,Services",3
693,Hyper Loyalty Programs Engagement,4,537,9210,1,1,2,17,3,5,1,5,"Lifestyle,Technology,Retail",5
694,AI-Driven Voice Search Optimization Outreach,1,321,6606,1,3,8,29,1,2,4,3,Education,2
695,Smart Email Marketing Campaign,1,1819,7121,4,3,4,15,2,2,4,1,Real Estate,1
696,Dynamic Guerrilla Marketing Plan,1,1162,4220,1,4,8,12,4,1,4,4,"Professional Services,Services,Fashion",2
697,NextGen Customer Referral Programs Strategy,2,1833,6198,2,2,6,25,1,2,5,1,"Local Business,Real Estate,Technology",4
698,Hyper Loyalty Programs Outreach,2,105,7788,3,2,6,18,2,2,1,4,"E-commerce,Events",1
699,AI-Driven Local SEO Outreach,1,1877,7980,3,2,8,17,4,5,5,5,All,3
700,Hyper Podcast Advertising Outreach,5,932,6123,1,2,10,19,3,4,3,4,"Manufacturing,All,Fitness,Entertainment",4
701,Ultimate Pay-Per-Click Advertising Engagement,4,1808,6916,4,2,10,25,4,4,4,5,"E-commerce,Lifestyle",4
702,Smart Social Media Marketing Growth,5,1108,2153,1,5,1,24,5,2,4,4,"Technology,Digital Products,Gaming",5
703,NextGen Augmented Reality Marketing Plan,3,1261,7952,2,1,4,22,3,2,3,2,"Technology,Events",2
704,Targeted Customer Referral Programs Strategy,2,367,9080,4,4,6,13,4,3,3,4,Local Business,5
705,Dynamic SMS Marketing Growth,5,700,5755,1,2,10,23,2,2,1,3,"Retail,Products,Manufacturing",4
706,Smart Conversational Marketing Plan,2,101,8415,4,4,9,22,1,1,3,2,"News,All,Gaming",5
707,NextGen Outbound Sales Growth,5,1987,3461,1,1,7,13,3,2,4,5,"B2B,Gaming,Local Business",5
708,Smart Influencer Marketing Growth,2,125,4794,3,5,2,27,2,4,3,4,"Fitness,Restaurants",5
709,NextGen Video Marketing Engagement,2,1198,4387,1,4,7,28,4,2,5,2,"Beauty,B2B,Gaming",4
710,Advanced User-Generated Content Engagement,4,1039,5293,4,3,6,18,4,1,3,4,"Fitness,Food,B2B,Technology",4
711,Ultimate LinkedIn Marketing Growth,4,592,4999,3,1,1,14,4,5,1,5,Restaurants,2
712,Dynamic Voice Search Optimization Growth,5,1790,5824,4,1,7,13,3,1,4,3,"Manufacturing,Fitness",3
713,NextGen Mobile App Marketing Strategy,1,1509,2282,4,3,10,20,3,4,5,1,"Local Business,Real Estate",1
714,Targeted Search Engine Optimization (SEO) Plan,3,1558,7757,3,1,5,20,5,2,3,3,"Technology,News",2
715,Advanced Local SEO Outreach,5,652,5460,3,1,6,24,3,5,3,4,"Services,Beauty,Products",2
716,NextGen User-Generated Content Outreach,2,1862,7567,2,2,8,17,4,2,4,2,"Education,News",4
717,NextGen Affiliate Marketing Plan,4,989,3885,2,1,3,25,2,5,4,5,Professional Services,1
718,Hyper Video Marketing Strategy,3,1850,2468,4,5,3,21,5,1,1,2,Local Business,2
719,Advanced SMS Marketing Outreach,2,730,7764,5,3,1,20,3,4,5,2,"Fashion,Real Estate",5
720,Dynamic Video Marketing Outreach,5,1508,8326,5,1,3,25,2,5,2,1,"Restaurants,B2B,Education",2
721,Targeted Video Marketing Strategy,3,1750,3192,4,5,6,13,4,2,5,5,"News,Fitness,Entertainment,Professional Services",4
722,Advanced Mobile App Marketing Engagement,5,1654,9329,1,2,3,24,3,3,3,5,"Professional Services,Retail",4
723,Hyper Micro-Influencer Marketing Strategy,1,608,9461,1,1,4,20,5,4,1,3,"Restaurants,Services",4
724,Ultimate Trade Shows & Events Engagement,5,1468,5232,2,1,8,21,4,2,3,2,Retail,2
725,Dynamic LinkedIn Marketing Strategy,2,1089,4962,2,3,10,15,1,5,5,3,SaaS,3
726,Targeted Social Media Marketing Growth,1,276,9695,4,2,8,26,3,3,4,1,E-commerce,3
727,NextGen Pay-Per-Click Advertising Campaign,3,1637,6316,2,3,4,28,5,5,2,3,E-commerce,2
728,NextGen Email Marketing Campaign,4,1561,5855,2,5,7,16,1,3,3,3,"Products,Fashion",1
729,Ultimate Mobile App Marketing Engagement,5,398,6835,5,1,8,17,1,1,3,4,"All,B2B,Travel,News",1
730,NextGen Guerrilla Marketing Plan,5,1382,2089,2,2,7,27,2,1,5,2,"Lifestyle,Gaming,Beauty",3
731,NextGen Customer Referral Programs Strategy,1,1359,9930,4,2,8,12,2,1,4,4,"Restaurants,Entertainment,Services,Retail",5
732,Hyper Interactive Content Strategy,5,1650,5301,5,5,9,27,1,5,2,2,"Food,Products,Fashion,Lifestyle",1
733,Smart Content Marketing Plan,2,853,8968,3,3,7,27,2,1,2,2,"Beauty,Products,Digital Products",5
734,AI-Driven Content Marketing Campaign,1,1242,9897,1,2,10,11,3,3,5,1,"E-commerce,Beauty",2
735,NextGen Micro-Influencer Marketing Plan,4,591,5870,5,5,5,24,1,3,4,4,Real Estate,3
736,Advanced Retargeting Campaigns Outreach,3,1896,9329,1,3,4,15,3,1,5,1,"B2B,Entertainment",5
737,NextGen Micro-Influencer Marketing Growth,5,1635,2753,2,2,7,27,4,3,3,4,"Events,SaaS,News,All",2
738,Targeted PR Campaigns Campaign,2,997,8217,4,1,1,10,3,3,3,5,Local Business,2
739,NextGen Loyalty Programs Outreach,3,1658,5842,1,1,4,27,4,3,3,1,"Travel,Digital Products",5
740,Smart SMS Marketing Growth,1,847,8453,1,1,7,30,3,3,4,3,E-commerce,5
741,Targeted PR Campaigns Strategy,1,658,9313,2,5,2,18,1,4,5,5,Fitness,1
742,Targeted PR Campaigns Campaign,1,1228,5959,1,4,3,26,1,2,4,3,"Professional Services,Education,SaaS,Retail",1
743,Hyper Social Media Ads Growth,3,258,4383,5,3,4,12,2,2,1,2,"Entertainment,Restaurants",5
744,Ultimate Social Media Marketing Strategy,5,588,9722,3,3,5,12,1,4,1,1,Fashion,5
745,Smart Customer Referral Programs Campaign,1,1145,2614,5,1,2,16,2,3,4,1,"Technology,Manufacturing",2
746,Smart Video Marketing Outreach,2,572,4877,4,5,3,14,3,1,2,3,"Lifestyle,Services,Beauty",5
747,Targeted Trade Shows & Events Engagement,1,800,2981,3,3,3,11,4,1,3,4,Professional Services,5
748,Hyper Trade Shows & Events Strategy,4,1248,7445,3,4,5,22,4,3,2,3,"Beauty,Lifestyle",4
749,AI-Driven Community Marketing Campaign,3,488,3019,1,5,2,12,1,1,5,1,"E-commerce,Real Estate",5
750,Hyper Retargeting Campaigns Outreach,2,920,4312,4,5,5,16,1,5,3,2,"E-commerce,All",1
751,NextGen Customer Referral Programs Engagement,2,1495,2093,5,2,7,20,2,3,4,2,"Products,Education,Fashion",5
752,Targeted Interactive Content Growth,1,1413,2166,1,5,8,10,4,4,4,1,"Products,Entertainment,All,Travel",1
753,Smart PR Campaigns Campaign,5,1068,6726,3,4,6,21,2,1,3,4,"B2B,Real Estate",4
754,Advanced Podcast Advertising Growth,3,162,9385,3,3,8,12,5,3,1,2,"Events,Beauty,Real Estate,Finance",5
755,NextGen Conversational Marketing Strategy,2,1579,2060,2,5,5,26,4,3,4,4,Professional Services,2
756,AI-Driven PR Campaigns Engagement,1,680,7603,5,3,1,10,1,3,2,5,"Manufacturing,SaaS",1
757,Smart PR Campaigns Campaign,1,821,7024,4,2,10,15,5,4,5,5,Food,4
758,AI-Driven Influencer Marketing Plan,5,1215,2550,5,5,8,18,4,2,4,1,"Entertainment,Lifestyle,Gaming",3
759,Advanced Email Marketing Outreach,1,989,4012,4,5,2,10,3,4,2,1,"Food,B2B,Local Business,Travel",5
760,Targeted Social Media Ads Growth,3,955,5757,2,3,2,15,2,4,2,4,Entertainment,4
761,Ultimate Podcast Advertising Strategy,5,420,2044,4,1,6,17,3,5,3,1,Events,2
762,AI-Driven Video Marketing Campaign,5,1585,3431,1,3,2,24,5,1,4,5,"Local Business,Products,E-commerce,Travel",1
763,NextGen PR Campaigns Plan,4,520,2708,4,4,1,20,4,3,4,1,"Local Business,Retail",1
764,Advanced Native Advertising Strategy,5,1649,9201,1,4,2,29,3,2,1,3,"Professional Services,Digital Products,Services",1
765,Smart Native Advertising Engagement,1,1624,8450,3,3,4,25,1,2,4,2,"Products,Finance,Travel",4
766,Smart Social Media Ads Engagement,2,1050,6980,3,2,5,13,5,5,1,3,"Services,Local Business",1
767,Ultimate Loyalty Programs Strategy,4,841,8574,5,5,2,19,4,5,5,2,"Retail,Digital Products,Fitness",5
768,NextGen Email Marketing Strategy,3,1076,7823,1,4,5,26,2,3,3,2,Real Estate,4
769,Dynamic Trade Shows & Events Strategy,1,906,8030,2,1,6,27,2,3,2,5,"Fitness,Education,Digital Products,News",4
770,Hyper Outbound Sales Growth,5,1431,4994,4,4,3,28,4,3,2,5,"Manufacturing,Technology,Products",4
771,Ultimate Content Marketing Plan,1,429,4839,1,3,9,25,1,5,1,5,"Services,Professional Services",3
772,NextGen Conversational Marketing Campaign,1,1145,5810,3,4,5,24,1,3,4,5,"SaaS,Entertainment",5
773,Ultimate Email Marketing Campaign,3,1986,8718,3,3,9,27,1,2,2,3,"B2B,Retail",1
774,Advanced Interactive Content Strategy,4,501,2759,5,1,5,29,4,3,1,4,"B2B,Professional Services,Real Estate",5
775,Advanced Customer Referral Programs Growth,5,1687,3323,5,3,5,12,4,5,2,2,"Education,Manufacturing",1
776,Smart Pay-Per-Click Advertising Growth,1,992,2921,1,5,1,11,1,1,1,2,"Services,News,Events",1
777,Hyper Retargeting Campaigns Growth,2,901,9341,3,3,6,20,2,1,4,3,"Real Estate,Education,Fitness",3
778,Advanced Search Engine Optimization (SEO) Plan,4,593,7683,2,5,2,15,5,5,3,2,Real Estate,4
779,Targeted Mobile App Marketing Outreach,2,331,7986,4,5,5,22,3,3,4,4,"Events,E-commerce,Food",4
780,Dynamic Video Marketing Growth,5,437,9822,5,4,8,18,1,1,4,5,"News,Professional Services,Technology,Local Business",3
781,Targeted LinkedIn Marketing Plan,1,244,3352,4,1,9,10,2,5,3,1,"Travel,Finance,Food,Digital Products",3
782,Dynamic Webinars Engagement,3,1938,2139,1,2,5,15,2,4,3,5,"News,Beauty,Lifestyle,Real Estate",4
783,AI-Driven Voice Search Optimization Plan,5,1699,7683,4,1,4,22,1,4,3,4,"Fashion,News",4
784,AI-Driven Guerrilla Marketing Strategy,3,373,2614,5,5,6,15,3,1,5,3,"Products,Gaming",2
785,Advanced Influencer Marketing Engagement,5,235,6088,5,2,5,12,3,1,5,1,"Retail,Events,Fitness",5
786,NextGen Loyalty Programs Plan,2,934,3084,5,3,3,27,3,5,5,4,"Education,Fashion,Services,Lifestyle",1
787,Hyper Outbound Sales Outreach,2,1627,7436,2,3,5,15,3,4,3,4,"Fashion,Education,Lifestyle",3
788,AI-Driven Email Marketing Strategy,3,1009,6570,4,3,7,10,5,2,4,2,"Events,Education,Fitness,Retail",4
789,NextGen Retargeting Campaigns Strategy,2,1171,7061,3,1,8,27,2,3,5,2,Retail,4
790,Dynamic Voice Search Optimization Growth,5,1744,3915,2,1,5,21,5,5,2,1,"Digital Products,Finance,Entertainment,Gaming",2
791,Ultimate Search Engine Optimization (SEO) Engagement,1,807,2858,2,1,8,11,5,4,3,5,Technology,2
792,Targeted Community Marketing Strategy,1,620,2371,5,2,10,11,1,4,5,1,"Local Business,Finance,Professional Services",4
793,NextGen Mobile App Marketing Growth,4,938,6236,1,3,10,15,3,5,4,1,"Real Estate,All",5
794,Advanced Mobile App Marketing Outreach,3,1833,5988,5,5,9,24,1,2,2,3,Events,1
795,Ultimate Augmented Reality Marketing Strategy,1,1089,3804,4,3,6,12,5,3,1,2,"Restaurants,Fashion,Lifestyle,News",2
796,Advanced Local SEO Engagement,2,348,3714,5,2,2,29,5,5,4,1,"Products,Professional Services,Food,Entertainment",4
797,Hyper Local SEO Strategy,5,1627,8316,1,3,6,12,4,1,1,1,Travel,2
798,NextGen SMS Marketing Strategy,4,934,9847,5,5,4,16,1,5,4,1,Technology,1
