strategy_id,strategy_name,budget_required,min_budget,max_budget,technical_expertise,time_investment,min_time_weekly,max_time_weekly,conversion_rate,brand_awareness,lead_generation,customer_retention,best_for_industry,target_audience_size
1,AI-Driven Affiliate Marketing Strategy,3,680,5677,4,1,5,24,1,3,1,1,"Travel,Gaming",3
2,Advanced Community Marketing Campaign,3,1126,3696,1,3,5,16,2,5,3,3,"Lifestyle,Services,Events",2
3,NextGen Video Marketing Engagement,1,429,6930,3,1,10,20,1,5,5,3,"Local Business,Finance",5
4,Targeted SMS Marketing Outreach,2,1538,9173,2,5,5,22,5,4,2,3,Real Estate,4
5,Hyper PR Campaigns Engagement,3,1972,7530,2,3,10,12,4,1,4,2,"Education,Digital Products",3
6,Hyper Local SEO Outreach,3,573,6514,4,5,9,24,2,4,1,4,"B2B,Beauty,Services,Technology",1
7,AI-Driven Content Marketing Plan,1,317,9970,2,5,6,26,2,3,2,4,"Products,Travel,Services,Manufacturing",4
8,Smart Social Media Marketing Outreach,4,1199,3095,5,1,7,10,4,2,3,1,"Retail,News,Local Business,Restaurants",2
9,Smart Conversational Marketing Strategy,1,1043,3137,1,4,7,13,5,1,1,5,"Products,Fitness",3
10,AI-Driven Content Marketing Growth,4,457,2628,2,1,10,14,1,5,2,4,"Manufacturing,News",4
11,AI-Driven Social Media Ads Outreach,4,1456,3229,3,3,2,29,3,3,4,3,"Travel,SaaS",3
12,Advanced Micro-Influencer Marketing Outreach,5,1283,5756,3,5,4,17,1,3,5,5,"SaaS,Events,News,Food",3
13,AI-Driven Pay-Per-Click Advertising Outreach,2,756,8047,1,1,9,11,4,2,4,4,"Fashion,SaaS,Real Estate",1
14,Ultimate Loyalty Programs Growth,1,665,9996,5,1,9,25,1,2,5,1,"Digital Products,Services,Products",3
15,Dynamic Native Advertising Outreach,2,606,5966,4,5,9,10,3,4,4,1,Travel,3
16,NextGen Community Marketing Campaign,4,887,5162,3,3,6,13,5,5,4,4,"Real Estate,Lifestyle",1
17,Dynamic Trade Shows & Events Strategy,1,779,2012,3,1,2,27,5,2,1,4,Digital Products,5
18,Ultimate Community Marketing Campaign,4,749,9438,5,3,2,24,4,2,1,5,"B2B,Services",1
19,Ultimate Trade Shows & Events Growth,5,1394,6954,4,5,8,26,3,5,1,3,"Events,Professional Services,Manufacturing,Education",2
20,Hyper Social Media Ads Growth,5,1062,8619,1,1,10,20,1,3,5,1,"Education,SaaS,Finance",1
21,Hyper LinkedIn Marketing Strategy,3,686,3311,2,4,1,13,5,1,5,2,All,5
22,Targeted Influencer Marketing Strategy,5,1800,3667,5,5,7,14,3,2,1,1,"E-commerce,Lifestyle,Fashion,B2B",1
23,AI-Driven Pay-Per-Click Advertising Plan,1,1656,8325,1,2,7,11,5,3,3,2,"Digital Products,B2B,News,Finance",1
24,Smart Trade Shows & Events Growth,4,421,3521,1,4,5,22,2,1,5,4,"Finance,All,News",4
25,Hyper Trade Shows & Events Plan,1,359,7825,2,5,4,25,3,2,4,3,"Professional Services,Retail,Local Business",1
26,Ultimate Augmented Reality Marketing Plan,1,794,4588,2,1,9,14,2,4,2,5,"Fashion,Retail",3
27,Smart Podcast Advertising Growth,4,1241,6999,3,2,5,13,3,4,4,2,"Events,Technology,Lifestyle,Gaming",2
28,Smart Affiliate Marketing Plan,5,380,7386,5,4,7,18,2,3,1,4,"Technology,Products,E-commerce",4
29,Smart Voice Search Optimization Outreach,2,209,5857,2,1,6,29,3,3,5,5,"Fashion,Finance,All",2
30,Advanced SMS Marketing Plan,5,1570,4197,3,3,4,17,2,2,1,5,Fashion,5
31,AI-Driven Micro-Influencer Marketing Strategy,2,242,6905,3,4,9,18,4,4,3,3,Retail,5
32,Ultimate Augmented Reality Marketing Growth,5,1778,3563,3,2,5,16,1,5,3,1,"Retail,SaaS",4
33,AI-Driven Social Media Ads Engagement,1,155,2984,4,2,10,13,5,3,2,2,"Fashion,Food,Real Estate",1
34,Dynamic Local SEO Engagement,1,1701,8708,3,1,8,18,2,3,1,3,"B2B,All,Services",1
35,NextGen User-Generated Content Strategy,1,979,6033,4,2,2,26,5,2,4,3,Education,3
36,Hyper Local SEO Strategy,5,274,7925,2,5,1,26,1,5,1,3,Food,3
37,NextGen SMS Marketing Strategy,5,1279,8868,2,3,4,21,4,3,3,1,"B2B,E-commerce,Digital Products,Products",3
38,Hyper Podcast Advertising Outreach,3,1598,6202,5,5,4,17,4,1,2,3,"Products,SaaS,Local Business",2
39,Smart LinkedIn Marketing Strategy,3,1790,8674,5,5,10,29,2,2,5,2,"Entertainment,E-commerce",5
40,Smart Conversational Marketing Outreach,2,401,9515,3,2,6,24,2,5,2,5,Education,4
41,Targeted Social Media Marketing Engagement,2,1183,2944,5,5,3,11,3,4,3,4,"Digital Products,Professional Services,Fitness",2
42,Dynamic Outbound Sales Engagement,1,1245,9679,3,2,6,19,1,1,4,1,"Entertainment,Digital Products,Restaurants",2
43,Smart User-Generated Content Strategy,3,657,5718,2,3,6,14,1,2,2,5,"Professional Services,Finance,SaaS",5
44,Dynamic Social Media Ads Outreach,5,1513,5413,3,5,1,17,1,2,4,3,"Restaurants,Digital Products,Fashion",2
45,AI-Driven PR Campaigns Outreach,2,1843,9620,2,2,4,19,3,1,3,5,"Manufacturing,Retail",3
46,Advanced Video Marketing Outreach,1,1602,6738,4,1,7,13,4,1,2,3,"Fitness,All,Education",1
47,Targeted Augmented Reality Marketing Plan,4,1160,5994,1,5,6,27,4,4,4,5,"Local Business,SaaS,Finance",5
48,AI-Driven PR Campaigns Strategy,2,1991,2882,4,5,4,20,1,3,2,2,Finance,2
49,AI-Driven Retargeting Campaigns Plan,4,926,9802,3,5,3,15,2,4,3,4,Manufacturing,4
50,Hyper Conversational Marketing Outreach,1,212,3000,2,3,10,21,2,3,1,4,"All,News,Education,Technology",4
51,Advanced Influencer Marketing Plan,1,1767,4838,3,4,8,25,5,4,4,1,"E-commerce,All",5
52,Advanced Video Marketing Strategy,4,1414,2276,5,3,2,24,3,3,1,1,"Travel,Restaurants,Local Business,Retail",4
53,NextGen Search Engine Optimization (SEO) Strategy,5,995,6569,2,4,4,28,4,5,4,5,"Travel,B2B",1
54,AI-Driven Trade Shows & Events Growth,1,1075,4716,1,3,8,23,3,3,1,2,Digital Products,1
55,Hyper Podcast Advertising Growth,5,1849,2249,2,5,6,21,5,4,3,5,Entertainment,3
56,Smart Social Media Marketing Strategy,5,1676,7186,1,5,4,27,4,4,5,5,Fashion,5
57,AI-Driven Webinars Strategy,3,686,3219,1,5,4,25,5,5,1,5,"B2B,Retail",5
58,Hyper Local SEO Campaign,2,1757,2598,2,4,9,28,5,3,1,2,"Food,Events,Local Business,SaaS",1
59,NextGen Pay-Per-Click Advertising Campaign,3,221,3893,5,2,7,25,3,2,5,2,SaaS,3
60,Advanced User-Generated Content Campaign,2,1295,5223,5,4,3,29,1,1,3,2,"Professional Services,Events",5
61,Dynamic Outbound Sales Outreach,4,1773,5259,3,3,6,13,4,5,5,1,Beauty,1
62,Hyper Social Media Ads Outreach,4,1056,4687,1,1,7,18,1,3,3,2,"Gaming,Lifestyle,Services",4
63,AI-Driven Social Media Marketing Campaign,4,679,3228,4,5,7,10,1,5,1,4,"Real Estate,Local Business",4
64,Hyper Loyalty Programs Campaign,1,628,3964,5,1,8,17,3,5,4,4,Entertainment,3
65,NextGen Outbound Sales Growth,5,1239,6087,1,4,4,14,2,3,5,1,"SaaS,News",4
66,Ultimate Loyalty Programs Outreach,5,372,5710,2,5,8,12,1,2,4,1,"All,Digital Products",1
67,NextGen Retargeting Campaigns Strategy,4,1640,5544,3,5,8,14,1,1,5,4,"Local Business,Beauty,Gaming,Digital Products",1
68,Smart SMS Marketing Growth,4,361,5534,5,4,9,16,2,5,1,5,"Fashion,Travel",5
69,NextGen Voice Search Optimization Growth,4,246,6667,5,5,5,22,2,3,1,4,Entertainment,1
70,Ultimate Search Engine Optimization (SEO) Campaign,1,1024,7706,2,4,2,28,4,4,4,5,Lifestyle,2
71,NextGen Conversational Marketing Engagement,1,712,9584,3,3,2,23,1,1,2,1,"Education,All,Real Estate,SaaS",4
72,Advanced Social Media Ads Engagement,4,1318,3210,4,5,8,12,5,1,4,1,Products,1
73,Hyper Loyalty Programs Growth,4,211,8663,1,2,2,27,2,3,3,4,"SaaS,Finance,Manufacturing",5
74,AI-Driven Customer Referral Programs Growth,1,1727,7393,1,3,8,11,4,1,1,5,"Entertainment,Professional Services,Beauty",2
75,Smart Content Marketing Campaign,3,221,7130,3,2,6,15,2,2,3,4,"SaaS,Entertainment",3
76,NextGen Content Marketing Outreach,1,1880,3263,1,2,5,16,1,3,3,5,"Entertainment,Food",5
77,Smart Trade Shows & Events Campaign,4,841,8261,3,1,6,24,3,1,1,4,"Beauty,Technology",3
78,Dynamic Loyalty Programs Growth,5,1076,6464,1,3,6,25,5,1,1,2,"Finance,Events,Education,Local Business",2
79,Ultimate Mobile App Marketing Outreach,4,334,5312,4,4,8,27,3,3,5,2,"Manufacturing,Real Estate,Restaurants",3
80,NextGen Social Media Ads Plan,5,850,9164,2,2,4,16,3,5,3,3,"Real Estate,E-commerce,Food,Finance",4
81,Targeted Native Advertising Campaign,4,148,7170,4,3,5,24,1,3,1,5,Services,1
82,Dynamic Conversational Marketing Plan,5,1905,2727,4,1,7,14,1,5,1,2,"News,E-commerce,Food",1
83,Smart Pay-Per-Click Advertising Engagement,4,204,2030,1,2,1,18,2,2,1,4,"Lifestyle,Services,Digital Products",5
84,Ultimate Loyalty Programs Plan,4,885,3669,4,5,8,28,4,3,5,5,"Events,Real Estate",2
85,Hyper Search Engine Optimization (SEO) Campaign,1,902,7504,1,3,4,17,5,1,4,4,Restaurants,2
86,Smart Search Engine Optimization (SEO) Outreach,2,834,3063,4,1,9,30,2,2,5,3,"Local Business,Finance,Events,Travel",2
87,AI-Driven Trade Shows & Events Outreach,1,394,5722,1,1,1,27,2,5,3,5,"Events,Real Estate",1
88,AI-Driven Loyalty Programs Campaign,3,1511,7094,5,3,5,12,1,5,1,5,"Lifestyle,All",1
89,Ultimate Augmented Reality Marketing Growth,2,555,6506,2,3,7,19,1,4,3,2,"Fashion,Services",3
90,AI-Driven Loyalty Programs Plan,3,949,6138,4,1,4,22,1,2,3,3,"Events,B2B",3
91,Smart Retargeting Campaigns Plan,4,659,2985,3,5,9,26,4,3,4,3,"SaaS,E-commerce,Manufacturing",2
92,Advanced Pay-Per-Click Advertising Strategy,5,1851,5030,1,1,2,22,2,1,1,2,"Entertainment,B2B,Fitness,Products",3
93,Dynamic Email Marketing Engagement,2,547,7043,4,3,9,11,4,3,5,2,"B2B,Lifestyle,Gaming,Professional Services",4
94,Dynamic Community Marketing Growth,4,1543,3750,2,3,10,14,5,3,4,2,"E-commerce,Food",4
95,Hyper Social Media Marketing Plan,4,1025,8688,2,4,5,26,4,3,1,2,"Technology,Real Estate",2
96,Hyper Influencer Marketing Campaign,3,312,8312,4,5,6,21,3,3,1,1,"Real Estate,Restaurants,B2B",2
97,AI-Driven Search Engine Optimization (SEO) Strategy,1,1300,8010,5,1,5,22,5,5,1,5,"Education,Digital Products,SaaS,Travel",2
98,Smart Customer Referral Programs Growth,1,1823,2042,4,3,5,23,2,1,3,5,Food,4
99,Advanced Content Marketing Growth,2,1225,3573,4,5,6,14,2,2,3,4,"Finance,Fitness,E-commerce",3
100,NextGen Loyalty Programs Campaign,5,1230,7522,1,2,10,23,3,2,2,3,"Local Business,Entertainment,Finance,Services",5
101,Hyper Podcast Advertising Outreach,4,1228,3146,3,2,6,23,2,1,5,2,"Food,Travel,Finance",1
102,Ultimate Native Advertising Growth,3,1838,6911,2,2,4,12,5,1,2,1,"Real Estate,Manufacturing,Education",1
103,Targeted Native Advertising Strategy,3,604,4205,2,2,10,22,1,1,4,5,"Manufacturing,Digital Products",4
104,AI-Driven Social Media Marketing Strategy,1,1753,2096,4,5,10,23,5,5,3,1,Education,2
105,Ultimate Social Media Ads Outreach,4,266,6197,2,1,10,23,1,5,2,2,"All,Food,E-commerce",5
106,Targeted Pay-Per-Click Advertising Plan,1,1077,7759,5,2,8,22,4,3,5,3,"Lifestyle,Entertainment,E-commerce,Beauty",3
107,Ultimate Podcast Advertising Campaign,1,1081,8709,2,1,2,10,3,3,2,5,"Fitness,Products,Education",4
108,Hyper Augmented Reality Marketing Growth,5,989,3624,3,1,10,28,2,3,5,4,E-commerce,3
109,AI-Driven Customer Referral Programs Plan,3,1432,8218,5,4,8,30,4,3,2,4,Technology,2
110,Ultimate Video Marketing Growth,1,1288,2509,5,5,2,11,2,4,3,1,"Local Business,Real Estate",2
111,Ultimate Micro-Influencer Marketing Outreach,1,139,4056,2,4,4,19,1,4,5,5,"Events,Technology,Education,Products",5
112,Advanced Email Marketing Strategy,4,1804,8743,1,1,8,20,5,4,3,3,Travel,3
113,Targeted Webinars Growth,1,307,2136,5,5,6,19,2,2,2,4,"Services,Professional Services,Fitness,Manufacturing",3
114,Hyper Social Media Marketing Engagement,3,137,2552,5,4,3,27,1,3,4,3,"Local Business,Lifestyle,Technology,Finance",1
115,Dynamic Retargeting Campaigns Campaign,2,398,7190,3,5,4,11,1,4,3,3,"Manufacturing,Events",4
116,AI-Driven Retargeting Campaigns Engagement,2,1757,8744,4,4,3,21,1,3,3,5,"Retail,Digital Products",4
117,Dynamic Outbound Sales Strategy,1,487,7328,4,1,4,17,2,3,4,5,"Education,Real Estate",1
118,AI-Driven Micro-Influencer Marketing Engagement,1,368,6042,1,4,1,25,2,2,5,5,"Education,Entertainment,Professional Services",4
119,AI-Driven LinkedIn Marketing Strategy,5,1061,6493,5,3,1,15,2,2,2,1,"Fitness,Professional Services,Retail,Manufacturing",3
120,Dynamic Retargeting Campaigns Engagement,2,686,7922,2,4,3,22,3,3,5,3,"Restaurants,Finance",3
121,Ultimate Social Media Ads Strategy,3,1309,3212,3,4,7,24,4,1,1,2,"Digital Products,Events,News,Beauty",3
122,Dynamic Micro-Influencer Marketing Strategy,1,1064,6619,3,4,10,23,1,1,2,3,Fashion,4
123,Hyper Community Marketing Growth,2,520,2631,5,3,7,29,1,5,1,4,"Manufacturing,Finance,Entertainment",3
124,Targeted SMS Marketing Campaign,2,1571,9961,4,1,9,27,1,5,4,4,"Services,Events",5
125,Hyper Social Media Marketing Growth,1,996,8774,4,5,1,16,5,1,4,1,"Travel,Entertainment,Real Estate",4
126,Targeted Influencer Marketing Plan,4,1202,4182,1,4,2,30,4,1,3,2,"Beauty,B2B,Manufacturing,Food",3
127,Ultimate Native Advertising Campaign,2,1944,8544,2,3,3,15,2,2,1,1,"Professional Services,B2B,Fitness,Fashion",2
128,NextGen Content Marketing Plan,5,791,7234,5,2,10,16,5,4,2,5,"Gaming,Food,Digital Products",3
129,Targeted Loyalty Programs Engagement,3,1374,4319,1,3,2,22,4,1,4,3,"Food,Restaurants,Retail",3
130,Advanced Guerrilla Marketing Growth,1,1144,7451,4,2,10,28,1,3,3,1,"Gaming,Professional Services,Services,E-commerce",5
131,Advanced Video Marketing Strategy,5,136,3002,2,5,2,15,4,3,4,1,Products,1
132,Ultimate Email Marketing Engagement,1,774,5572,2,3,2,22,1,3,5,5,"News,Fashion,B2B,Real Estate",5
133,AI-Driven Video Marketing Engagement,3,1083,7116,2,5,5,18,5,4,4,2,"Real Estate,Finance,News,Travel",5
134,AI-Driven Webinars Strategy,1,1673,4968,4,1,7,15,2,2,2,5,"All,Retail,Manufacturing",5
135,Advanced Podcast Advertising Campaign,4,1406,4312,1,4,2,16,2,1,2,4,"Products,Beauty,Local Business,Education",3
136,Dynamic Guerrilla Marketing Engagement,3,276,8996,1,3,1,13,1,3,4,3,"Food,Products,All,Education",3
137,Advanced SMS Marketing Plan,3,1409,7459,3,3,4,17,5,2,2,4,"Digital Products,Finance,Retail",1
138,Ultimate SMS Marketing Plan,2,735,8865,2,4,6,26,3,3,3,3,"Retail,Finance,Professional Services,Travel",2
139,AI-Driven SMS Marketing Outreach,4,1398,7534,5,5,2,17,5,2,5,5,"Digital Products,Lifestyle,Retail,Travel",2
140,Targeted Pay-Per-Click Advertising Outreach,5,407,7885,3,3,9,10,3,3,5,1,"Food,Gaming,Travel,Lifestyle",2
141,Targeted Video Marketing Growth,3,1416,9925,1,2,8,19,1,4,3,2,E-commerce,1
142,Advanced SMS Marketing Growth,1,578,3276,2,4,5,25,5,2,1,4,"Gaming,Beauty,Events",1
143,Hyper Loyalty Programs Outreach,4,1562,3922,5,4,10,18,3,1,3,3,"Real Estate,News,Restaurants",2
144,Hyper User-Generated Content Plan,5,856,4730,3,1,3,17,3,3,4,2,"Local Business,Professional Services,Retail",3
145,Ultimate Email Marketing Engagement,4,885,8574,4,1,6,24,2,5,4,2,"Products,All",4
146,NextGen Native Advertising Outreach,4,1837,5526,2,3,2,14,5,1,5,1,"Food,Professional Services,News,Technology",1
147,Hyper Webinars Plan,2,141,4211,5,3,10,23,3,2,4,4,"Products,Fitness,Manufacturing",1
148,Dynamic Local SEO Campaign,5,1095,5492,5,2,2,28,3,2,4,4,"Education,Food",3
149,NextGen Search Engine Optimization (SEO) Outreach,4,1339,5765,4,1,7,28,4,2,2,3,"Digital Products,Lifestyle,Finance,E-commerce",5
150,Ultimate Community Marketing Growth,2,1966,3927,1,4,7,29,4,4,4,5,"Professional Services,Local Business,Retail",2
151,Targeted Trade Shows & Events Plan,1,874,5355,1,5,2,25,2,4,4,4,"News,Services,Fashion",2
152,Advanced Social Media Ads Strategy,5,189,9304,5,5,7,11,5,3,4,3,"All,Products",1
153,Ultimate Native Advertising Plan,2,776,6129,5,1,9,18,3,3,5,1,"Retail,Finance,Restaurants",2
154,Targeted Email Marketing Engagement,4,794,6721,4,1,9,21,4,5,4,2,E-commerce,5
155,Dynamic PR Campaigns Strategy,2,1259,4851,2,3,3,30,2,5,3,1,Digital Products,4
156,AI-Driven Pay-Per-Click Advertising Strategy,5,1721,3450,2,4,5,27,5,5,4,2,"Travel,Restaurants,News,Digital Products",5
157,Ultimate PR Campaigns Plan,3,469,8514,3,1,4,28,5,2,1,4,"Lifestyle,Fitness,E-commerce",3
158,Hyper Search Engine Optimization (SEO) Plan,1,358,9332,4,2,8,16,5,5,1,5,Fitness,4
159,Dynamic Mobile App Marketing Campaign,4,1649,2476,4,4,9,17,2,1,4,5,"Finance,Events",1
160,Hyper SMS Marketing Engagement,1,1222,5584,4,5,1,19,1,2,1,1,"Digital Products,Events,Retail",2
161,Smart Guerrilla Marketing Campaign,5,1806,4229,3,4,9,19,4,4,3,4,"Professional Services,Beauty,Retail,E-commerce",1
162,NextGen Native Advertising Growth,1,1594,3804,2,3,6,20,4,2,5,2,"Digital Products,News,Services",2
163,Dynamic Customer Referral Programs Growth,4,782,8138,2,2,7,26,3,3,1,4,"Finance,Restaurants",3
164,NextGen Conversational Marketing Growth,1,402,4188,2,5,1,27,5,3,3,2,"News,Manufacturing,E-commerce,Retail",5
165,Dynamic Email Marketing Outreach,2,1488,2329,3,5,2,11,2,1,3,4,"News,Education",1
166,Advanced Webinars Engagement,1,214,2563,2,5,10,10,2,2,2,5,"Food,Events,News,Travel",2
167,Ultimate Webinars Growth,4,189,3940,2,4,1,10,4,5,2,4,Events,5
168,NextGen Augmented Reality Marketing Outreach,5,344,9205,5,1,4,26,5,2,5,5,"Retail,Professional Services",1
169,Ultimate Micro-Influencer Marketing Engagement,4,1200,5531,3,3,4,13,3,1,1,1,"Products,Entertainment,E-commerce,Services",5
170,Dynamic SMS Marketing Outreach,2,564,6806,4,4,9,23,4,2,1,2,"Education,Lifestyle,Retail,Services",2
171,Targeted Retargeting Campaigns Plan,4,766,9991,4,5,10,17,1,5,4,3,"Finance,Lifestyle",5
172,Ultimate Interactive Content Engagement,3,1115,3454,2,5,5,17,2,2,4,1,Entertainment,4
173,NextGen Community Marketing Engagement,2,710,3224,3,4,1,21,1,2,2,4,"Finance,Manufacturing,Products",1
174,Targeted Customer Referral Programs Engagement,2,1783,6352,3,5,3,17,1,4,4,2,Entertainment,3
175,Ultimate Podcast Advertising Growth,2,1891,5744,4,2,6,21,2,3,1,2,"News,Beauty,Restaurants,Fitness",5
176,AI-Driven Loyalty Programs Outreach,1,1858,4945,5,3,10,16,1,4,3,2,"B2B,Gaming,Education,Finance",1
177,AI-Driven Retargeting Campaigns Plan,2,1732,8968,2,2,10,11,4,4,3,5,"Entertainment,Local Business,Professional Services",3
178,Smart Voice Search Optimization Engagement,5,205,6514,4,5,7,26,3,5,3,5,"Fashion,Digital Products,Entertainment,Finance",1
179,NextGen Customer Referral Programs Outreach,4,1425,4962,2,4,8,12,4,3,3,1,Manufacturing,5
180,Ultimate Trade Shows & Events Campaign,5,1910,5734,1,5,6,28,1,5,4,5,"Fashion,Beauty,Fitness",4
181,Advanced Affiliate Marketing Campaign,3,263,9947,1,3,5,28,4,4,1,2,Travel,3
182,Targeted Interactive Content Outreach,4,1952,3399,1,5,3,28,2,2,4,2,"B2B,Products,Fashion,Gaming",3
183,Ultimate Voice Search Optimization Campaign,1,623,5032,5,1,3,21,5,3,1,2,Education,2
184,Targeted Pay-Per-Click Advertising Plan,3,683,9674,5,1,6,13,5,2,1,1,"News,Technology",2
185,Smart Webinars Engagement,5,187,9925,3,5,8,14,3,3,2,4,"Retail,Events,Real Estate",4
186,NextGen Email Marketing Plan,1,987,4713,5,2,2,13,5,1,3,3,Gaming,4
187,Advanced Pay-Per-Click Advertising Plan,4,1413,8767,1,2,5,22,4,4,4,2,"Events,Services,Finance,Manufacturing",4
188,Targeted Email Marketing Campaign,2,293,5610,4,4,6,24,5,1,4,3,"Beauty,E-commerce,Fashion,Events",5
189,NextGen Trade Shows & Events Outreach,1,237,4561,1,2,10,30,3,4,3,1,"Professional Services,Digital Products",4
190,AI-Driven Guerrilla Marketing Plan,5,1207,7521,1,2,3,10,4,2,3,1,Manufacturing,2
191,Ultimate Trade Shows & Events Outreach,2,1810,8845,3,3,2,14,5,3,3,2,"Education,Fashion,Fitness,B2B",2
192,Targeted Outbound Sales Outreach,4,264,6918,2,1,2,23,4,4,3,4,"Professional Services,Manufacturing,Education,E-commerce",4
193,Dynamic User-Generated Content Engagement,1,219,2837,5,2,10,25,3,2,3,1,"Manufacturing,All,Lifestyle",1
194,AI-Driven Content Marketing Plan,5,156,2521,5,1,2,18,3,4,1,2,"B2B,Local Business,Real Estate,All",5
195,NextGen PR Campaigns Outreach,1,357,7277,2,2,5,19,3,5,5,2,"Education,Beauty,Manufacturing,Fitness",1
196,Targeted Mobile App Marketing Engagement,1,1995,3667,4,2,4,14,5,4,2,2,"Products,Professional Services,Gaming,Fashion",1
197,Advanced Community Marketing Engagement,4,108,5959,4,1,4,16,2,1,5,5,"Fitness,Travel,Education",5
198,Hyper SMS Marketing Strategy,5,1474,7663,1,3,2,24,2,4,3,1,"Fashion,Events,Gaming,Local Business",4
199,Hyper Content Marketing Outreach,2,1882,4031,1,3,2,17,5,5,5,3,Real Estate,1
200,Advanced Community Marketing Outreach,1,1562,7986,1,4,7,11,4,4,1,4,"Fitness,E-commerce,Professional Services,Education",4
201,NextGen Podcast Advertising Strategy,2,1751,8752,3,3,7,30,5,2,4,1,"Food,Real Estate,Digital Products",2
202,Advanced Local SEO Growth,4,864,8391,2,5,2,24,4,2,1,4,"Local Business,Events,All,Products",1
203,Targeted Influencer Marketing Outreach,5,1418,5142,1,4,6,11,1,3,5,5,"Gaming,Fitness,Food,Products",4
204,Ultimate Trade Shows & Events Strategy,2,1110,6099,3,4,3,16,3,2,4,2,Beauty,2
205,Targeted Influencer Marketing Engagement,4,899,2123,3,2,2,19,1,3,2,4,"Local Business,News,Professional Services",2
206,Dynamic Local SEO Plan,2,755,3392,1,4,2,27,5,5,2,2,"Entertainment,Products",3
207,NextGen Search Engine Optimization (SEO) Plan,3,1712,2023,1,4,1,29,1,2,4,5,"SaaS,Food,Real Estate",3
208,NextGen Interactive Content Campaign,1,1859,3756,1,4,3,21,1,1,3,1,"Fashion,Events",5
209,Targeted Content Marketing Campaign,5,220,6704,2,1,10,26,1,2,3,2,Finance,1
210,Smart Interactive Content Plan,4,508,7532,1,5,5,14,1,4,4,5,"Products,Beauty",2
211,NextGen SMS Marketing Strategy,3,1522,2787,3,3,8,22,1,3,4,2,"Travel,Beauty,Education",3
212,Advanced Loyalty Programs Plan,3,237,5971,3,2,10,25,3,4,1,3,"Beauty,Finance,News,B2B",1
213,Targeted Micro-Influencer Marketing Campaign,2,864,6992,4,3,1,10,2,1,3,5,"Local Business,Food,Fitness",4
214,Hyper Micro-Influencer Marketing Outreach,4,133,9886,1,2,4,12,4,3,1,2,"Local Business,Gaming",1
215,Targeted Augmented Reality Marketing Engagement,1,639,6861,1,1,1,26,2,3,3,2,"Restaurants,Technology,Real Estate,Gaming",2
216,NextGen Affiliate Marketing Strategy,1,873,9088,3,1,9,28,1,1,3,5,"Gaming,Manufacturing,Education",1
217,NextGen Augmented Reality Marketing Growth,5,485,2498,4,5,1,22,2,4,4,3,Events,2
218,NextGen Voice Search Optimization Growth,5,229,9888,4,4,10,28,4,4,1,2,"Finance,Entertainment,Fashion",5
219,Ultimate Loyalty Programs Plan,1,775,3051,2,3,2,22,4,5,4,3,"News,Real Estate,Finance,Services",3
220,Advanced Native Advertising Growth,2,845,7054,2,3,8,17,4,3,2,5,"Fitness,Events,Travel,Technology",5
221,Dynamic Customer Referral Programs Engagement,1,1006,2879,3,5,7,13,5,3,3,1,"Retail,All,B2B",4
222,Ultimate Trade Shows & Events Engagement,1,344,6228,2,3,9,17,1,3,2,3,"Beauty,Retail",1
223,Targeted Webinars Outreach,2,136,6339,5,3,2,30,5,1,5,3,Food,1
224,Hyper Interactive Content Engagement,3,1713,6873,1,4,10,25,1,3,3,5,Fitness,3
225,Dynamic Podcast Advertising Strategy,5,1183,4270,1,5,10,10,4,4,1,3,SaaS,3
226,Advanced Influencer Marketing Engagement,5,1462,7435,2,3,2,11,3,1,5,2,"Manufacturing,All",1
227,Targeted Content Marketing Campaign,1,287,2075,1,4,7,29,5,3,3,1,"Food,Events,E-commerce,Entertainment",5
228,Advanced Affiliate Marketing Outreach,4,1167,7451,2,1,9,12,3,3,1,5,"Entertainment,News",5
229,Targeted Community Marketing Plan,1,1119,9312,1,1,3,28,4,3,1,4,"Products,News,SaaS",3
230,Smart Podcast Advertising Strategy,4,929,2561,3,1,6,13,5,4,1,5,"Fitness,Professional Services,Fashion,Beauty",2
231,Targeted Voice Search Optimization Growth,4,690,6582,1,1,9,11,3,2,5,4,"Digital Products,B2B",3
232,Hyper SMS Marketing Plan,1,1897,8060,5,2,4,13,2,1,3,4,"E-commerce,Products,Travel",5
233,NextGen Conversational Marketing Engagement,1,846,3178,1,2,2,13,4,4,3,1,"Finance,Gaming,Technology,Travel",2
234,AI-Driven Mobile App Marketing Plan,2,379,2073,1,4,9,23,5,1,5,2,"All,Food",4
235,Targeted Podcast Advertising Plan,1,1283,9016,4,4,2,18,2,1,1,5,News,1
236,NextGen Loyalty Programs Plan,5,938,6022,1,1,1,21,5,2,5,1,Real Estate,1
237,Dynamic Micro-Influencer Marketing Plan,2,631,3978,1,4,9,16,5,2,1,4,"Food,Fashion,Travel,B2B",1
238,Hyper Mobile App Marketing Outreach,4,615,3673,4,4,8,22,5,1,2,1,"Lifestyle,Restaurants,Real Estate,Technology",5
239,Dynamic Local SEO Campaign,2,1174,8512,3,3,10,27,5,1,2,2,Services,2
240,Hyper Pay-Per-Click Advertising Growth,2,916,2685,3,1,10,21,2,4,5,5,"Fashion,Professional Services",2
241,NextGen Local SEO Plan,2,1674,2497,1,4,3,27,4,3,1,1,B2B,4
242,Hyper Influencer Marketing Campaign,4,436,8738,3,3,5,21,2,5,5,5,"Lifestyle,Education",3
243,Targeted Conversational Marketing Growth,1,1637,6265,4,3,1,21,3,5,5,4,Products,1
244,Ultimate Outbound Sales Strategy,2,280,3623,3,3,7,22,3,1,2,5,"Finance,Restaurants",3
245,NextGen Loyalty Programs Engagement,2,1310,3363,1,5,10,10,1,1,5,4,"Restaurants,B2B,Beauty",5
246,Advanced Voice Search Optimization Strategy,1,1211,8269,5,3,4,20,2,4,4,4,"News,Real Estate,All,Gaming",3
247,AI-Driven LinkedIn Marketing Outreach,5,1134,9363,2,5,5,24,2,5,1,5,"Digital Products,B2B,Entertainment,Services",2
248,Smart Search Engine Optimization (SEO) Campaign,3,487,3848,3,4,10,25,1,1,2,5,"Digital Products,Education",5
249,NextGen Interactive Content Plan,4,1165,2634,1,3,7,11,2,4,2,4,Retail,2
250,NextGen Search Engine Optimization (SEO) Strategy,1,160,4223,2,5,10,23,5,2,3,1,Beauty,3
251,Advanced Search Engine Optimization (SEO) Engagement,3,201,9158,4,2,10,22,3,1,3,3,"All,Professional Services",5
252,NextGen Micro-Influencer Marketing Outreach,4,1896,9404,2,5,3,12,1,1,1,2,"Beauty,Events,Digital Products,Travel",1
253,Dynamic Retargeting Campaigns Strategy,5,187,2279,3,4,2,19,1,2,4,4,E-commerce,3
254,Hyper Email Marketing Plan,1,225,4572,3,2,4,17,3,1,4,4,"Entertainment,Food",3
255,Dynamic Trade Shows & Events Campaign,2,306,4508,4,3,3,17,5,4,5,4,Lifestyle,3
256,Hyper Loyalty Programs Growth,1,733,7150,4,3,2,20,1,3,3,3,"Restaurants,Gaming",4
257,Advanced Guerrilla Marketing Plan,2,1519,3001,3,5,5,30,3,2,1,2,"Services,SaaS",1
258,Hyper Social Media Marketing Outreach,3,1454,8510,5,2,4,28,4,1,3,4,"Local Business,Lifestyle,Digital Products,Fashion",5
259,Hyper Affiliate Marketing Engagement,3,1374,4090,4,4,8,28,3,3,5,2,"Services,Fitness",3
260,Hyper Affiliate Marketing Strategy,1,913,4126,1,5,7,19,1,5,3,2,Restaurants,4
261,NextGen Customer Referral Programs Growth,4,426,6962,5,2,9,22,1,3,3,3,Fitness,1
262,Advanced Local SEO Plan,2,1686,2944,4,4,9,21,4,2,3,3,"News,Lifestyle,SaaS",3
263,Targeted Mobile App Marketing Campaign,1,1245,2033,3,3,8,28,3,4,4,5,"Lifestyle,All,Services",2
264,NextGen Search Engine Optimization (SEO) Campaign,2,175,6157,2,2,7,13,4,1,3,1,"Entertainment,Manufacturing,B2B",3
265,Targeted LinkedIn Marketing Growth,1,672,6443,1,3,2,15,2,4,4,5,All,5
