strategy_id,strategy_name,budget_required,min_budget,max_budget,technical_expertise,time_investment,min_time_weekly,max_time_weekly,conversion_rate,brand_awareness,lead_generation,customer_retention,best_for_industry,target_audience_size
266,Hyper Trade Shows & Events Strategy,3,1514,2737,3,3,1,20,1,4,5,5,"Travel,Education,B2B",1
267,Dynamic Webinars Plan,3,1741,9630,3,5,4,22,3,2,1,4,"Beauty,SaaS",1
268,Hyper Email Marketing Strategy,3,1362,3882,5,1,3,24,5,3,4,1,B2B,2
269,Targeted PR Campaigns Outreach,3,795,4552,1,3,3,22,5,4,3,1,Travel,5
270,Hyper Social Media Marketing Engagement,2,1056,3403,3,1,1,15,5,4,1,5,Education,3
271,Advanced Interactive Content Strategy,1,1639,3425,3,4,10,21,3,3,5,3,"Real Estate,Gaming,Events",5
272,Targeted Guerrilla Marketing Strategy,4,880,2970,4,2,1,27,2,1,3,3,"Fashion,B2B",2
273,Hyper Outbound Sales Outreach,2,728,5202,1,5,3,23,3,3,1,2,"Professional Services,Restaurants,Real Estate,Lifestyle",1
274,Advanced Trade Shows & Events Growth,4,1943,4526,3,1,4,19,2,1,4,3,"Travel,Fitness",5
275,Ultimate Community Marketing Outreach,5,101,5224,3,5,9,21,3,4,2,5,SaaS,1
276,AI-Driven Outbound Sales Outreach,5,584,5302,2,4,2,19,2,4,2,1,"All,Travel,Beauty,Local Business",1
277,Hyper Augmented Reality Marketing Strategy,5,1182,5012,1,2,6,10,3,2,2,5,E-commerce,4
278,Smart Local SEO Outreach,3,819,7305,3,2,10,29,5,5,4,1,"Beauty,Manufacturing,SaaS,Food",1
279,NextGen Email Marketing Outreach,3,1807,2191,1,4,5,25,2,4,1,3,Digital Products,3
280,Dynamic Social Media Ads Plan,5,1340,9219,1,2,8,25,4,2,2,5,"Gaming,Education,Fashion,Local Business",3
281,Ultimate Video Marketing Plan,5,1874,9446,3,3,1,28,2,3,5,2,"Beauty,Finance,Travel,B2B",1
282,Advanced PR Campaigns Engagement,4,482,8999,4,5,2,20,1,1,3,2,"E-commerce,Technology,Travel",2
283,Hyper Retargeting Campaigns Growth,2,1945,7058,3,3,1,23,2,3,1,4,"Events,Education,Beauty,SaaS",3
284,Dynamic Email Marketing Growth,5,1520,3213,4,4,6,21,3,5,2,1,"Real Estate,Finance,Professional Services,News",2
285,Ultimate Voice Search Optimization Growth,1,473,8506,5,4,2,15,3,2,4,4,"Lifestyle,Events,Manufacturing",5
286,Hyper Podcast Advertising Growth,2,377,9340,1,3,5,18,3,3,1,2,"SaaS,Gaming",3
287,Targeted Podcast Advertising Campaign,2,1868,8090,4,2,3,20,3,4,3,5,"Finance,Education,Events,Real Estate",3
288,Dynamic Webinars Growth,2,863,3062,1,4,10,14,4,3,1,4,Travel,3
289,Hyper Search Engine Optimization (SEO) Strategy,5,1010,8946,2,5,1,13,5,3,5,5,E-commerce,4
290,Ultimate Native Advertising Growth,2,1254,6257,5,2,9,29,1,4,5,2,"Restaurants,Real Estate,Professional Services,Technology",5
291,Ultimate Customer Referral Programs Outreach,3,1471,4224,4,2,6,11,5,5,1,1,"E-commerce,Entertainment",4
292,Hyper Retargeting Campaigns Growth,4,673,4678,4,3,8,18,5,3,4,4,"Food,B2B",1
293,Dynamic Augmented Reality Marketing Campaign,1,1855,9656,5,5,6,28,4,4,3,2,"Education,Products,All,Events",5
294,AI-Driven Trade Shows & Events Growth,1,1801,3531,5,3,4,23,1,4,4,2,"News,Restaurants",4
295,Targeted Search Engine Optimization (SEO) Growth,4,1108,7585,4,2,2,16,4,2,3,1,"Lifestyle,Travel",4
296,Targeted Trade Shows & Events Outreach,5,1189,9617,4,5,9,12,5,1,4,2,Manufacturing,5
297,Advanced PR Campaigns Growth,2,1648,2121,3,3,7,12,5,2,1,3,"Services,Products,B2B",1
298,AI-Driven User-Generated Content Engagement,3,214,9105,4,2,3,15,3,5,3,2,"Products,Events,Services",5
299,Advanced Retargeting Campaigns Plan,2,834,8964,1,2,6,30,5,1,3,3,"Manufacturing,Professional Services",3
300,AI-Driven Interactive Content Engagement,4,626,3445,4,3,6,22,4,4,2,3,"Finance,Digital Products",1
301,NextGen Community Marketing Growth,4,530,9244,5,1,4,16,2,4,1,1,"Food,Services,B2B",4
302,Advanced Native Advertising Outreach,1,1571,8910,5,5,5,11,2,5,5,5,"Restaurants,Travel",5
303,Targeted PR Campaigns Growth,2,1434,5619,3,1,2,26,2,1,1,2,Entertainment,5
304,Hyper LinkedIn Marketing Engagement,1,1072,7305,2,4,9,17,3,5,3,1,"Professional Services,SaaS,Products,B2B",5
305,Ultimate Webinars Engagement,2,1341,7086,1,4,4,17,5,5,2,4,Gaming,3
306,Ultimate Customer Referral Programs Strategy,2,708,3419,4,3,8,15,3,4,2,5,"Digital Products,Finance,All",2
307,Smart Affiliate Marketing Plan,2,1517,3802,1,5,5,10,5,2,4,4,"Beauty,SaaS",4
308,NextGen Micro-Influencer Marketing Growth,3,1377,3173,3,3,5,13,5,1,1,2,"News,E-commerce,Fashion,Education",2
309,NextGen Retargeting Campaigns Campaign,1,1906,8929,3,2,6,12,4,4,2,1,"B2B,Entertainment,Products",2
310,Ultimate Conversational Marketing Engagement,2,1537,5466,1,2,10,13,2,4,1,2,SaaS,4
311,Smart SMS Marketing Strategy,1,923,8168,3,4,4,21,4,2,2,3,News,4
312,Dynamic Pay-Per-Click Advertising Plan,5,968,6107,1,3,4,15,4,2,3,1,"Retail,Professional Services",5
313,Targeted Affiliate Marketing Campaign,1,1739,7238,1,4,4,13,2,4,2,4,"Manufacturing,Professional Services",4
314,Dynamic Community Marketing Strategy,1,1099,7236,1,3,10,13,3,3,4,5,"Fitness,Events",5
315,Hyper Video Marketing Outreach,4,1977,9966,3,5,3,28,4,3,4,5,"Events,Fashion,Finance",5
316,Advanced Video Marketing Engagement,1,706,4097,4,2,3,24,5,4,3,3,Digital Products,5
317,Targeted Webinars Campaign,1,1286,7962,2,3,1,11,2,3,1,5,"Entertainment,Travel,E-commerce",5
318,Ultimate Conversational Marketing Growth,1,792,7739,5,1,3,11,5,3,1,1,"Retail,B2B,Travel,Local Business",1
319,Dynamic Affiliate Marketing Growth,1,1540,5017,5,5,2,16,5,5,3,4,"Digital Products,Real Estate,Fitness,E-commerce",1
320,Dynamic User-Generated Content Campaign,3,1521,7052,2,1,1,16,2,5,3,1,"Entertainment,Retail,Fashion,Education",2
321,Hyper Customer Referral Programs Plan,3,1709,7821,3,1,2,15,1,1,1,4,"SaaS,Food",1
322,Dynamic LinkedIn Marketing Strategy,2,1449,5927,2,2,6,17,1,5,1,3,"Professional Services,Digital Products,Local Business",5
323,Advanced Search Engine Optimization (SEO) Strategy,3,866,6452,5,4,2,25,1,2,3,3,"Professional Services,All",5
324,AI-Driven PR Campaigns Campaign,4,1872,8446,1,1,7,13,4,2,2,3,E-commerce,1
325,Ultimate Guerrilla Marketing Growth,1,1275,4419,5,5,9,16,1,4,3,4,"All,Gaming",4
326,AI-Driven Podcast Advertising Growth,5,1328,3201,5,3,5,26,3,5,2,1,"Technology,Professional Services,Fashion,Lifestyle",2
327,Smart Voice Search Optimization Strategy,4,950,3320,1,4,8,19,5,5,4,4,"Beauty,Real Estate",3
328,Advanced Interactive Content Engagement,5,501,6575,5,3,1,21,3,2,2,4,"Professional Services,Services,Real Estate",4
329,Hyper Social Media Marketing Plan,3,1699,5419,3,5,2,11,1,3,1,5,Beauty,3
330,Ultimate Content Marketing Engagement,3,547,2682,2,1,8,20,2,1,1,2,B2B,2
331,Hyper Podcast Advertising Plan,4,1912,9714,4,3,3,28,1,5,4,3,"Entertainment,B2B,Events",2
332,Targeted Local SEO Campaign,3,672,7854,2,4,4,25,3,1,3,1,"Food,E-commerce,SaaS",1
333,Targeted Local SEO Outreach,2,1172,3390,5,5,1,25,5,3,2,5,"Food,Fashion",5
334,Targeted PR Campaigns Campaign,1,1277,7632,4,2,1,14,3,2,4,1,"Products,SaaS",1
335,Targeted Augmented Reality Marketing Outreach,1,106,8298,1,3,1,13,2,3,5,3,"Professional Services,Fitness,Products",2
336,Hyper Retargeting Campaigns Growth,3,117,4121,2,1,9,17,2,3,5,4,"Products,Local Business,Food",5
337,AI-Driven Podcast Advertising Outreach,1,1808,7936,3,1,6,10,3,3,2,3,"Products,B2B",5
338,Ultimate Social Media Ads Engagement,1,1561,6258,5,4,10,22,3,1,1,1,"News,Food",5
339,NextGen Trade Shows & Events Plan,2,1856,4753,1,2,2,26,2,1,2,3,"Food,Finance,News",2
340,Smart Retargeting Campaigns Engagement,2,674,3552,3,1,5,15,2,4,2,2,"Local Business,Technology,Gaming",5
341,Targeted Influencer Marketing Plan,5,1053,3001,4,2,1,14,4,3,2,4,"Real Estate,Retail,Professional Services",3
342,Ultimate Content Marketing Strategy,1,1991,6418,2,5,10,15,3,4,3,4,Fitness,2
343,Ultimate Affiliate Marketing Plan,2,1834,2921,2,4,8,29,3,1,2,3,Restaurants,2
344,Targeted Loyalty Programs Engagement,3,1110,3908,3,3,7,21,2,5,1,2,"Beauty,Gaming,Real Estate",5
345,Ultimate Native Advertising Engagement,2,1116,5679,3,5,3,15,5,3,2,4,Travel,5
346,NextGen Podcast Advertising Plan,1,633,8879,5,2,7,23,4,3,4,4,Retail,3
347,Smart Guerrilla Marketing Outreach,1,1994,9785,1,2,10,22,5,1,1,3,Food,3
348,AI-Driven Loyalty Programs Campaign,2,1179,6796,1,5,4,15,3,3,4,3,"Fashion,SaaS,Technology",5
349,Advanced Micro-Influencer Marketing Campaign,3,1822,9846,3,5,5,10,1,1,1,3,"Retail,Travel,Gaming",1
350,NextGen Pay-Per-Click Advertising Campaign,3,1572,6006,1,5,2,21,1,3,5,2,"Finance,B2B,Professional Services",4
351,NextGen Loyalty Programs Engagement,2,1524,2126,3,2,6,12,2,3,4,3,"Digital Products,Food,Restaurants,B2B",1
352,Dynamic Search Engine Optimization (SEO) Outreach,3,727,8940,3,4,8,14,1,2,5,4,Travel,4
353,Dynamic Affiliate Marketing Plan,4,1832,8674,5,4,2,11,3,2,5,3,News,4
354,Targeted Email Marketing Outreach,5,1230,6187,5,1,5,10,1,4,4,4,"Local Business,Finance,Events",3
355,Dynamic LinkedIn Marketing Campaign,1,517,2803,3,2,4,27,3,4,2,3,"E-commerce,Retail",4
356,Advanced Micro-Influencer Marketing Engagement,3,415,7961,4,1,10,25,1,1,2,2,"Fitness,News,Beauty,Gaming",3
357,NextGen Community Marketing Plan,3,1750,4356,4,2,4,20,2,5,3,4,"E-commerce,Finance",3
358,Targeted User-Generated Content Engagement,5,585,2362,1,4,9,11,5,3,1,5,"News,Entertainment",3
359,Smart Local SEO Plan,1,860,7662,5,1,3,29,5,1,5,5,"Services,Real Estate,SaaS,Lifestyle",2
360,Ultimate Native Advertising Campaign,1,1971,7852,5,4,4,12,5,4,3,3,"Restaurants,Finance,E-commerce,B2B",5
361,AI-Driven Micro-Influencer Marketing Outreach,5,273,8375,4,3,2,11,4,1,5,3,"Entertainment,E-commerce,Education,SaaS",3
362,Dynamic Influencer Marketing Campaign,1,1428,3161,1,2,6,23,2,3,4,1,"Gaming,Local Business",5
363,Ultimate Influencer Marketing Outreach,2,1061,7161,4,3,3,11,2,5,2,4,"B2B,SaaS,Local Business,Gaming",2
364,Smart Email Marketing Strategy,5,1656,4095,3,1,9,14,5,4,5,2,"Fitness,Restaurants,Real Estate",4
365,Smart Guerrilla Marketing Campaign,4,883,2709,3,4,3,10,3,5,4,2,"Finance,Fitness,Professional Services,News",3
366,NextGen Trade Shows & Events Campaign,5,471,5094,5,5,6,28,3,2,1,5,"Real Estate,Retail,Professional Services",3
367,NextGen Affiliate Marketing Engagement,4,1257,5442,4,4,3,28,2,1,2,1,"SaaS,Travel",4
368,Advanced Mobile App Marketing Growth,5,395,2676,5,5,7,25,3,2,1,4,"SaaS,Real Estate,Products,Entertainment",5
369,AI-Driven LinkedIn Marketing Outreach,1,1759,5549,5,2,5,14,2,2,4,4,"Beauty,Gaming",5
370,Advanced Local SEO Campaign,2,901,4699,2,1,4,26,2,2,1,3,"Events,Digital Products,B2B,Lifestyle",1
371,Hyper Guerrilla Marketing Engagement,1,1021,8891,1,3,5,19,4,2,5,2,"Fashion,Gaming",1
372,Targeted Guerrilla Marketing Strategy,5,562,8555,3,5,3,26,5,3,5,4,"Food,Restaurants,Digital Products,Fashion",2
373,Dynamic User-Generated Content Growth,5,1359,2001,2,3,3,23,3,2,3,2,"E-commerce,Retail,Products,Services",5
374,Advanced Retargeting Campaigns Outreach,1,115,3170,1,5,3,25,5,2,2,5,SaaS,5
375,Targeted Webinars Engagement,2,360,5254,5,4,2,20,1,4,2,4,SaaS,5
376,AI-Driven PR Campaigns Campaign,2,173,8783,3,3,7,16,1,1,2,2,"All,Gaming,B2B",3
377,Advanced LinkedIn Marketing Campaign,4,1225,7138,1,3,7,16,2,5,3,2,"Travel,Technology",1
378,Hyper LinkedIn Marketing Engagement,1,1909,5982,3,5,9,23,3,5,3,4,"Travel,SaaS",1
379,Advanced Podcast Advertising Growth,2,563,6821,5,4,9,17,1,4,5,1,"Restaurants,Professional Services,Events,Fashion",1
380,Ultimate User-Generated Content Outreach,3,686,9482,3,1,3,13,5,2,3,3,"Fitness,Digital Products,Entertainment,Travel",5
381,NextGen Augmented Reality Marketing Outreach,5,1273,4816,2,3,4,19,4,1,1,4,"Digital Products,Finance,Technology",3
382,NextGen Augmented Reality Marketing Engagement,3,712,7315,3,4,5,10,5,4,5,5,Services,5
383,Dynamic Voice Search Optimization Growth,3,367,9928,4,5,3,13,4,1,2,3,"Restaurants,All,Services,Finance",5
384,NextGen Mobile App Marketing Strategy,3,1128,7873,3,5,9,25,5,2,1,5,Technology,2
385,Targeted Trade Shows & Events Engagement,3,864,7704,1,5,8,14,1,1,4,2,Fitness,2
386,Targeted Conversational Marketing Plan,3,750,6586,1,2,1,13,3,3,5,3,"Fashion,SaaS,Food,Local Business",4
387,Ultimate Micro-Influencer Marketing Engagement,5,912,5756,3,5,2,12,3,4,4,1,Retail,3
388,Ultimate Video Marketing Plan,5,102,7993,2,2,10,21,5,5,4,1,"Entertainment,Finance",5
389,Targeted Native Advertising Plan,3,1511,2157,1,3,9,26,3,4,5,1,Events,5
390,Ultimate Podcast Advertising Growth,4,902,5396,1,4,8,21,4,1,1,5,"News,Beauty,Events,Food",1
391,Targeted Interactive Content Engagement,4,1658,6087,2,3,2,15,1,4,4,5,Finance,4
392,AI-Driven Social Media Marketing Strategy,4,1662,2521,2,3,5,21,5,1,5,5,"Retail,Real Estate",3
393,Targeted PR Campaigns Plan,3,1194,8633,5,5,10,23,1,2,4,3,"All,Events,Technology",5
394,Smart Video Marketing Outreach,1,1416,7231,2,5,4,19,2,3,1,5,"Professional Services,Retail,Fitness",1
395,Smart Trade Shows & Events Strategy,5,360,3753,4,4,2,27,5,2,5,2,"Manufacturing,Restaurants,SaaS,Events",5
396,Targeted Content Marketing Outreach,1,490,4676,2,2,5,30,2,2,3,5,"Manufacturing,News,Fashion,Real Estate",3
397,NextGen Webinars Engagement,3,1056,7940,3,4,6,27,3,4,4,3,"Professional Services,Restaurants",1
398,Ultimate Trade Shows & Events Plan,3,1012,8839,5,1,1,22,3,5,5,3,"Lifestyle,Digital Products",4
399,AI-Driven Affiliate Marketing Strategy,3,1145,6175,3,3,6,23,4,2,5,1,Retail,1
400,Smart Webinars Plan,4,1605,8195,4,1,3,19,3,3,2,4,Professional Services,2
401,Ultimate Influencer Marketing Campaign,1,1067,3581,4,2,1,24,3,2,5,4,Local Business,3
402,Advanced Video Marketing Campaign,1,1257,8429,3,2,1,30,1,3,4,4,"All,Digital Products,Technology",4
403,NextGen Community Marketing Plan,1,223,3620,2,5,3,10,4,2,3,1,"Real Estate,Food",2
404,Hyper Customer Referral Programs Strategy,4,914,7638,1,2,5,28,3,3,2,2,"Travel,B2B",3
405,Smart Webinars Outreach,1,998,4635,1,4,10,26,3,1,4,3,"Travel,Education",1
406,Hyper Customer Referral Programs Strategy,3,1531,2354,5,4,2,15,3,2,1,5,"B2B,SaaS,Real Estate,Gaming",3
407,Advanced Affiliate Marketing Strategy,2,507,9026,2,2,4,17,4,3,1,2,"Education,Manufacturing,Finance",4
408,NextGen Community Marketing Plan,2,151,5269,3,1,9,11,2,1,1,1,"Finance,Beauty,Fashion",5
409,Hyper Trade Shows & Events Outreach,4,1414,8047,2,4,3,10,4,1,1,2,Beauty,2
410,AI-Driven Outbound Sales Plan,3,1186,9051,1,2,9,23,1,1,5,2,"SaaS,Food,Fitness",2
411,Ultimate Social Media Ads Growth,2,724,7755,2,2,8,11,4,4,3,2,"Retail,Food",3
412,NextGen Social Media Ads Growth,1,1070,3802,2,2,10,24,3,5,3,4,"Products,E-commerce,Entertainment,SaaS",2
413,AI-Driven Community Marketing Campaign,4,1945,8586,4,3,3,17,3,4,5,4,"B2B,Technology,Fitness",3
414,Smart Social Media Ads Strategy,4,825,2792,5,5,5,27,3,2,2,4,"News,SaaS,Events,Professional Services",2
415,Dynamic Voice Search Optimization Growth,3,1986,6044,3,4,5,12,3,4,3,2,Beauty,2
416,Ultimate Webinars Growth,2,1115,3735,2,2,7,28,3,5,5,1,"Digital Products,Local Business",1
417,AI-Driven Voice Search Optimization Growth,2,1561,6921,1,2,10,23,3,5,1,2,"Finance,Fitness",2
418,Ultimate Conversational Marketing Plan,3,914,5821,3,2,5,26,5,4,4,1,"Retail,Education,Travel",4
419,Ultimate SMS Marketing Plan,4,479,8725,2,1,3,15,1,2,3,5,"Local Business,Travel,Digital Products",3
420,Smart Social Media Ads Outreach,5,815,9254,4,2,8,29,3,1,3,1,"Fitness,Retail",5
421,Ultimate Influencer Marketing Outreach,1,120,5599,5,2,2,25,1,4,1,4,"News,Digital Products,Travel",4
422,Targeted Outbound Sales Plan,4,492,5658,1,4,1,24,4,2,4,3,"Professional Services,Fitness,Services,News",4
423,Dynamic Video Marketing Growth,4,859,3951,2,3,1,20,5,5,2,4,"Fashion,Technology",4
424,Ultimate Guerrilla Marketing Outreach,5,986,6267,3,1,9,15,4,2,5,3,"Manufacturing,Real Estate",2
425,Smart Social Media Marketing Strategy,4,1155,7177,4,2,10,12,2,1,2,1,All,3
426,Advanced PR Campaigns Campaign,2,1577,4881,3,4,6,10,1,1,5,4,"Lifestyle,Local Business",4
427,Hyper Outbound Sales Growth,5,1461,2806,4,3,2,29,5,2,2,2,"Professional Services,Beauty",5
428,Advanced Trade Shows & Events Strategy,2,1383,8249,5,1,8,17,4,5,2,2,"Local Business,Services,Gaming",5
429,Hyper Retargeting Campaigns Campaign,4,415,8080,5,4,3,10,4,3,2,1,"Fashion,Beauty,Retail,Events",2
430,NextGen Loyalty Programs Outreach,2,397,4708,5,3,4,21,2,2,2,3,Fitness,1
431,Smart Content Marketing Strategy,2,853,6328,1,1,10,10,2,2,2,3,Professional Services,5
432,Targeted Affiliate Marketing Campaign,3,1322,8403,2,2,10,21,5,1,4,2,"Events,Products,All,Digital Products",2
433,Hyper Affiliate Marketing Plan,5,1678,6252,2,1,6,17,3,2,3,5,"Fashion,Retail,Travel,Food",3
434,Smart Micro-Influencer Marketing Strategy,2,1031,4057,3,4,8,10,2,2,1,4,"Restaurants,Professional Services,Digital Products,Retail",3
435,AI-Driven SMS Marketing Campaign,2,1503,9363,1,3,6,24,1,4,4,5,Products,2
436,Hyper Mobile App Marketing Outreach,5,884,7031,1,4,10,27,3,3,2,3,"All,Manufacturing,Beauty",3
437,AI-Driven Influencer Marketing Campaign,2,1221,9646,1,3,10,17,3,4,3,1,"Manufacturing,Finance",2
438,Ultimate PR Campaigns Plan,1,274,3463,2,5,6,24,5,1,1,5,"Beauty,Education,Digital Products",4
439,Hyper Conversational Marketing Plan,4,1785,4176,3,4,7,26,4,4,1,4,"Products,Restaurants,Fashion,Events",3
440,Ultimate Local SEO Outreach,1,1367,3129,2,4,9,12,3,3,5,4,Real Estate,4
441,Ultimate Webinars Engagement,4,1150,7696,1,2,7,13,4,2,1,5,Fitness,4
442,Dynamic Guerrilla Marketing Plan,2,1811,8636,3,5,3,29,3,3,4,5,"E-commerce,Events,Restaurants,Real Estate",4
443,Targeted Outbound Sales Plan,3,376,9131,5,5,6,26,2,1,4,3,"Products,Retail,Real Estate",4
444,AI-Driven Email Marketing Campaign,4,415,8278,5,4,7,20,2,2,5,3,"Gaming,Local Business,Fashion,Digital Products",2
445,Ultimate Pay-Per-Click Advertising Plan,3,1869,3945,1,2,3,23,3,3,1,4,Education,1
446,Targeted Augmented Reality Marketing Plan,2,483,9755,2,2,8,13,1,2,3,1,Events,1
447,Hyper Micro-Influencer Marketing Outreach,4,118,4951,4,4,6,16,4,3,5,2,E-commerce,5
448,Targeted Affiliate Marketing Growth,5,694,9161,1,4,10,12,1,1,4,2,"Manufacturing,Beauty,Professional Services,Food",2
449,Hyper Podcast Advertising Plan,5,1218,9074,3,1,8,25,4,4,2,1,"Lifestyle,Local Business",4
450,AI-Driven Micro-Influencer Marketing Growth,3,1886,3777,4,3,9,10,1,5,4,1,"Fitness,Gaming",5
451,Targeted Native Advertising Campaign,1,1573,9403,5,1,7,17,1,5,1,1,Lifestyle,5
452,Ultimate Conversational Marketing Growth,2,256,3672,4,2,8,21,3,1,5,3,"Entertainment,Lifestyle",5
453,Hyper Native Advertising Growth,5,1333,6957,3,5,1,14,5,3,2,4,"SaaS,Products",2
454,Dynamic Community Marketing Outreach,5,217,2923,3,1,10,20,5,3,2,3,"Fitness,Professional Services,B2B,Products",5
455,Targeted Email Marketing Growth,2,685,3863,2,4,7,11,4,1,2,5,"E-commerce,Gaming",2
456,Smart Customer Referral Programs Strategy,1,106,7161,5,3,10,14,5,2,4,4,"Beauty,Digital Products,Lifestyle,SaaS",4
457,Dynamic Trade Shows & Events Engagement,4,467,4287,4,5,4,18,3,4,1,2,Fitness,5
458,Advanced Video Marketing Campaign,2,1809,5046,4,4,3,26,4,4,2,5,Lifestyle,5
459,NextGen Email Marketing Growth,3,1006,8127,5,4,6,24,4,1,1,4,"Beauty,Travel,Food,SaaS",3
460,Ultimate Influencer Marketing Growth,5,1603,4425,2,1,6,28,2,1,1,5,"Technology,Food",2
461,Ultimate Guerrilla Marketing Outreach,2,1911,3235,2,2,9,30,4,1,2,4,"SaaS,Fitness,Restaurants",1
462,Hyper Retargeting Campaigns Campaign,3,617,9205,3,3,8,12,4,5,3,5,Retail,3
463,Advanced Social Media Marketing Campaign,4,1650,7405,1,4,1,28,4,1,5,1,"SaaS,Fitness",2
464,Targeted Conversational Marketing Strategy,4,1755,2288,1,4,8,27,3,3,2,3,"SaaS,Manufacturing,Real Estate,Restaurants",1
465,Targeted Video Marketing Outreach,5,1357,7021,2,1,5,24,4,3,4,3,Fitness,5
466,Advanced Micro-Influencer Marketing Campaign,5,1709,3757,5,5,2,23,3,1,4,4,"Technology,Fitness,SaaS",5
467,Advanced Social Media Marketing Engagement,5,611,6646,5,2,9,10,2,1,3,4,"Beauty,Travel,Manufacturing,SaaS",2
468,Dynamic LinkedIn Marketing Growth,4,1261,3020,5,5,4,10,5,5,3,4,E-commerce,4
469,Smart Video Marketing Growth,3,1615,5384,2,2,9,10,5,4,3,3,"Real Estate,Digital Products,Products",4
470,Advanced Outbound Sales Outreach,2,1264,9921,2,2,3,20,5,4,5,5,"Education,Food,Events,Professional Services",1
471,Targeted Conversational Marketing Strategy,4,1828,6812,5,1,7,14,2,4,3,4,"Gaming,SaaS",3
472,Smart Influencer Marketing Engagement,2,202,7860,5,5,8,15,3,4,1,4,"Local Business,All",5
473,Dynamic Native Advertising Engagement,5,1392,6865,3,5,9,14,4,4,5,2,Education,4
474,Ultimate Community Marketing Campaign,5,864,6949,1,4,4,22,2,5,1,4,"Manufacturing,Education,B2B",4
475,Ultimate Influencer Marketing Plan,2,1013,3612,5,2,3,28,5,3,2,4,Restaurants,4
476,NextGen Customer Referral Programs Plan,3,984,8297,5,1,3,13,1,5,2,5,"Beauty,SaaS",1
477,Targeted Voice Search Optimization Strategy,1,894,3126,2,2,9,17,3,4,1,2,"Fitness,Technology",3
478,Advanced Mobile App Marketing Outreach,5,1264,4253,1,5,3,10,4,4,2,4,"Services,Events,Beauty,Real Estate",2
479,Targeted Loyalty Programs Campaign,4,1819,4562,5,3,9,17,4,3,5,3,Digital Products,4
480,NextGen Influencer Marketing Strategy,4,1474,6597,3,2,8,26,4,5,2,5,"Fitness,All,B2B,Real Estate",4
481,Targeted Trade Shows & Events Engagement,4,169,3533,2,4,7,26,1,3,1,4,"E-commerce,Manufacturing",3
482,NextGen SMS Marketing Engagement,1,445,6504,4,2,1,26,4,4,3,2,"Manufacturing,Digital Products",5
483,Dynamic Content Marketing Campaign,5,802,3061,3,2,4,25,3,4,4,4,"Fashion,Digital Products",2
484,NextGen Augmented Reality Marketing Campaign,4,803,8643,4,3,4,24,5,5,4,3,"Restaurants,SaaS",1
485,Hyper Search Engine Optimization (SEO) Campaign,5,1724,7056,4,1,8,30,3,5,2,4,"Travel,Entertainment,Real Estate,Services",2
486,Smart SMS Marketing Campaign,4,823,2149,2,3,2,22,4,2,1,4,Food,5
487,Ultimate Content Marketing Plan,1,1293,5921,5,1,3,25,1,3,2,4,"Local Business,Restaurants,Events",2
488,Dynamic Video Marketing Outreach,3,1636,2069,1,3,8,18,2,4,4,3,"Digital Products,E-commerce",1
489,Hyper Webinars Outreach,2,1570,3434,5,2,1,29,3,1,3,2,Manufacturing,5
490,Ultimate PR Campaigns Engagement,5,1697,2628,1,5,6,10,3,5,4,1,"Finance,Digital Products,Food",5
491,Advanced Retargeting Campaigns Engagement,5,517,3320,5,5,4,24,1,3,3,2,"Education,Fashion,Retail",3
492,Smart Social Media Marketing Campaign,5,103,6164,1,4,4,16,3,4,5,1,Education,3
493,AI-Driven Interactive Content Campaign,2,519,8509,3,1,3,16,4,4,1,2,"Lifestyle,Services,Gaming,SaaS",5
494,Smart LinkedIn Marketing Growth,3,581,2852,1,4,7,28,2,3,2,2,"Beauty,Food,Products,Travel",1
495,Hyper Social Media Ads Growth,1,1297,4407,2,4,10,27,2,3,1,5,Finance,2
496,AI-Driven Conversational Marketing Campaign,5,1860,7064,4,5,2,27,1,1,1,3,"E-commerce,Entertainment,B2B",2
497,Ultimate SMS Marketing Campaign,4,553,7930,2,5,1,11,4,4,3,5,"News,B2B",3
498,Hyper Community Marketing Outreach,4,1405,9084,2,3,6,24,3,2,2,4,"Local Business,Events,News",1
499,Advanced Guerrilla Marketing Engagement,1,1940,3439,2,1,1,23,2,3,4,3,"B2B,Lifestyle,Finance,SaaS",2
500,Advanced Podcast Advertising Campaign,4,1874,9633,2,3,4,29,3,2,4,2,"Technology,Education,Products,News",4
501,AI-Driven Influencer Marketing Strategy,5,1994,2284,4,2,5,20,2,4,2,1,"Restaurants,Food,Technology",1
502,Smart Content Marketing Growth,1,309,7966,2,5,6,27,3,5,1,2,"Education,E-commerce",4
503,Targeted Content Marketing Outreach,5,258,2458,4,5,10,20,2,4,1,5,News,4
504,AI-Driven Search Engine Optimization (SEO) Campaign,3,1230,6826,2,5,8,23,2,3,2,1,"Local Business,Manufacturing",5
505,Smart Augmented Reality Marketing Campaign,1,302,2439,5,3,2,27,2,5,3,5,Entertainment,2
506,AI-Driven Guerrilla Marketing Plan,3,1570,7830,3,2,9,21,4,5,3,2,Education,5
507,Hyper Influencer Marketing Outreach,1,1385,7034,3,3,6,12,1,4,4,1,"Fitness,Beauty",1
508,Smart Loyalty Programs Plan,4,855,6324,1,2,4,17,5,5,5,4,"Fashion,Retail",1
509,NextGen SMS Marketing Strategy,2,512,7067,5,2,2,16,3,5,3,1,"Real Estate,All",1
510,NextGen Micro-Influencer Marketing Strategy,1,1115,3277,3,1,7,14,3,3,3,2,"All,Fitness,Products",2
511,AI-Driven Pay-Per-Click Advertising Plan,4,1878,8835,1,3,2,10,2,3,2,2,"Local Business,Events",1
512,Smart Augmented Reality Marketing Campaign,5,908,2511,3,1,10,24,2,2,2,5,"Beauty,Manufacturing,B2B",2
513,AI-Driven LinkedIn Marketing Campaign,3,177,3457,1,1,9,18,1,1,1,3,"Real Estate,All",5
514,Dynamic Mobile App Marketing Plan,3,525,5183,2,4,7,25,3,1,1,3,"Professional Services,Fashion,Products,Beauty",3
515,Advanced SMS Marketing Plan,3,316,8298,2,3,7,22,3,5,3,2,"Products,Lifestyle,Events",1
516,Ultimate Search Engine Optimization (SEO) Plan,3,808,4055,5,1,8,23,3,4,5,5,"Professional Services,Food",4
517,Hyper Video Marketing Plan,2,1410,9591,5,2,6,18,3,5,1,4,"B2B,All,Entertainment,Food",5
518,Hyper Pay-Per-Click Advertising Plan,4,681,6931,1,5,10,30,3,4,2,1,Travel,4
519,Targeted Content Marketing Growth,3,1468,3506,1,3,6,17,3,4,2,5,"Finance,Fitness,Retail,All",2
520,Ultimate Video Marketing Plan,5,790,3234,2,3,10,23,5,5,3,5,"Products,Restaurants",5
521,Ultimate Customer Referral Programs Outreach,3,658,5601,4,5,10,26,5,5,3,3,Fitness,2
522,NextGen Social Media Ads Outreach,3,678,5256,1,1,4,27,5,5,4,1,"Fitness,Technology,Food,Digital Products",2
523,AI-Driven Outbound Sales Outreach,2,707,5034,5,4,1,29,3,2,4,2,"Fashion,Restaurants,Technology,All",3
524,Ultimate Community Marketing Outreach,1,806,9102,1,3,3,26,2,3,3,2,"Local Business,Professional Services,All,Technology",4
525,AI-Driven Influencer Marketing Plan,4,1312,5038,4,4,2,21,1,3,2,4,"Manufacturing,Finance,Food,Gaming",4
526,Targeted Native Advertising Growth,4,1274,9020,2,5,8,16,1,1,4,5,"Technology,Fashion,Events,Beauty",2
527,Smart Native Advertising Strategy,5,1017,4129,4,1,1,29,3,3,5,2,"Technology,Local Business,Digital Products,Fitness",4
528,Targeted Trade Shows & Events Growth,2,1555,8887,2,1,2,19,5,4,1,3,"Fashion,Entertainment,Professional Services,Events",5
529,AI-Driven Local SEO Campaign,3,1250,2640,1,3,3,11,5,4,5,5,"Technology,Services,Events,Fashion",3
530,Smart Local SEO Growth,5,1021,7239,5,5,6,20,4,2,2,3,"Lifestyle,News,Food",4
531,Dynamic Affiliate Marketing Engagement,4,629,9207,2,1,9,12,1,1,1,3,Local Business,2
532,AI-Driven Customer Referral Programs Strategy,3,213,5107,3,1,8,24,4,3,1,3,"Food,Manufacturing,Fitness",2
